Cleaned_Tweet,Segmented_Text
kabinet merah putih mendukung kebijakan perlindungan hak asasi manusia yang sejalan dengan prinsipprinsip keadilan,kabinet merah putih mendukung kebijakan perlindungan hak asasi manusia yang sejalan dengan prinsipprinsip keadilan
istana pastikan pejabat kabinet merah putih pakai mobil dinas maung pindad,istana pastikan pejabat kabinet merah putih pakai mobil dinas maung pindad
tidak akan pakai mobil toyota alphard tetapi pakai mobil maung itu anggito menyebut prabowo meminta pejabat menggunakan mobil buatan anak bangsa tidak hanya para menteri pejabat eselon i dalam kabinet merah putih akan dilarang menggunakan mobil mewah buatan luar negeri,tidak akan pakai mobil toyota alphard tetapi pakai mobil maung itu anggito menyebut prabowo meminta pejabat menggunakan mobil buatan anak bangsa tidak hanya para menteri pejabat eselon i dalam kabinet merah putih akan dilarang menggunakan mobil mewah buatan luar negeri
mengikuti retreat di akmil magelang para menteri semakin solid untuk menyongsong masa depan bangsa pembekalan dan kebersamaan yang terjalin pasti memperkuat langkah menuju indonesia emas terus maju kabinet merah putih,mengikuti retreat di akmil magelang para menteri semakin solid untuk menyongsong masa depan bangsa pembekalan dan kebersamaan yang terjalin pasti memperkuat langkah menuju indonesia emas terus maju kabinet merah putih
retreat kabinet merah putih berakhir bawa pulang kebersamaan ke jakarta lewat online,retreat kabinet merah putih berakhir bawa pulang kebersamaan ke jakarta lewat online
dalam kegiatan retreat kabinet merah putih di magelang itu para pembantu presiden mendapatkan gemblengan berupa materi tentang bernegara dan pemerintahan termasuk materi penting soal pencegahan korupsi,dalam kegiatan retreat kabinet merah putih di magelang itu para pembantu presiden mendapatkan gemblengan berupa materi tentang bernegara dan pemerintahan termasuk materi penting soal pencegahan korupsi
kabinet merah putih mempercepat pengembangan energi terbarukan demi masa depan yang lebih hijau,kabinet merah putih mempercepat pengembangan energi terbarukan demi masa depan yang lebih hijau
resmi ppn naik bulan depan manteri ekonomi kabinet merah putih menyelenggarakan konferensi pers paket kebijakan ekonomi salah satu agendanya adalah penerapan ppn sebesar yang berlaku umum mulai januari gtgt,resmi ppn naik bulan depan manteri ekonomi kabinet merah putih menyelenggarakan konferensi pers paket kebijakan ekonomi salah satu agendanya adalah penerapan ppn sebesar yang berlaku umum mulai januari gtgt
salut sama programprogramnya kabinet merah putih dari ketahanan pangan sampe digitalisasi semuanya top,salut sama programprogramnya kabinet merah putih dari ketahanan pangan sampe digitalisasi semuanya top
di bawah presiden prabowo kabinet merah putih mendukung kebijakan ekonomi biru untuk memperkuat sektor kelautan,di bawah presiden prabowo kabinet merah putih mendukung kebijakan ekonomi biru untuk memperkuat sektor kelautan
sektor pariwisata kita makin booming good job kabinet merah putih,sektor pariwisata kita makin booming good job kabinet merah putih
penasehat khusus presiden prabowo subianto di kabinet merah putih pak presidennya bukan jokowi lagi pak tapi pak prabowo ganti muhadjir effendi dari kabinet merah putih,penasehat khusus presiden prabowo subianto di kabinet merah putih pak presidennya bukan jokowi lagi pak tapi pak prabowo ganti muhadjir effendi dari kabinet merah putih
menteri perlindungan pekerja migran indonesiakepala badan perlindungan pekerja migran indonesia abdul kadir karding juga mengungkap presiden prabowo yang membiayai kegiatan retreat kabinet merah putih dengan uang pribadi,menteri perlindungan pekerja migran indonesiakepala badan perlindungan pekerja migran indonesia abdul kadir karding juga mengungkap presiden prabowo yang membiayai kegiatan retreat kabinet merah putih dengan uang pribadi
kabinet merah putih berkomitmen untuk menciptakan lapangan kerja baru,kabinet merah putih berkomitmen untuk menciptakan lapangan kerja baru
selama empat hari jajaran kabinet merah putih melaksanakan retreat di akmil magelang jawa tengah bentuk pilar kemajuan indonesia,selama empat hari jajaran kabinet merah putih melaksanakan retreat di akmil magelang jawa tengah bentuk pilar kemajuan indonesia
rakyat bersuara malam ini kabinet merah putih bulan siap diganti live di inews,rakyat bersuara malam ini kabinet merah putih bulan siap diganti live di inews
yang lain juga dong tolong itu jajaran nama di kabinet merah putih apa gak mau sekalian aja,yang lain juga dong tolong itu jajaran nama di kabinet merah putih apa gak mau sekalian aja
usulan rehabilitasi muncul dokter tifa sampaikan kritik terhadap sikap gibran setelah retret kabinet merah putih tindakan gibran yang dinilai tidak sepenuhnya menunjukkan komitmen dalam menjalankan tugas sebagai wakil presiden,usulan rehabilitasi muncul dokter tifa sampaikan kritik terhadap sikap gibran setelah retret kabinet merah putih tindakan gibran yang dinilai tidak sepenuhnya menunjukkan komitmen dalam menjalankan tugas sebagai wakil presiden
usai lulus akmil lembah tidar semangat kabinet merah putih makin berkobar saksikan catatan demokrasi live malam ini pukul wib di tvone amp,usai lulus akmil lembah tidar semangat kabinet merah putih makin berkobar saksikan catatan demokrasi live malam ini pukul wib di tvone amp
di bawah presiden prabowo kabinet merah putih mempercepat program penanganan stunting untuk meningkatkan kualitas generasi mendatang,di bawah presiden prabowo kabinet merah putih mempercepat program penanganan stunting untuk meningkatkan kualitas generasi mendatang
presiden prabowo menggelar rapat terbatas bersama menteri kabinet merah putih panglima tni kapolri dan kepala bin terkait persiapan natal dan tahun baru di kantor presiden istana kepresidenan jakarta senin hub,presiden prabowo menggelar rapat terbatas bersama menteri kabinet merah putih panglima tni kapolri dan kepala bin terkait persiapan natal dan tahun baru di kantor presiden istana kepresidenan jakarta senin hub
menteriwamen kabinet merah putih menghadap wapres gibran wakil presiden ri gibran rakabuming raka melakukan pertemuan tertutup dengan sejumlah menteri dan wakilnya di kantor wakil presiden jakarta,menteriwamen kabinet merah putih menghadap wapres gibran wakil presiden ri gibran rakabuming raka melakukan pertemuan tertutup dengan sejumlah menteri dan wakilnya di kantor wakil presiden jakarta
kabinet merah putih memastikan setiap kebijakan pembangunan memperhatikan keseimbangan ekologi,kabinet merah putih memastikan setiap kebijakan pembangunan memperhatikan keseimbangan ekologi
sektor kelautan makin kuat apresiasi buat kabinet merah putih,sektor kelautan makin kuat apresiasi buat kabinet merah putih
kabinet merah putih mempercepat pemulihan ekonomi pascapandemi dengan kebijakan yang prorakyat,kabinet merah putih mempercepat pemulihan ekonomi pascapandemi dengan kebijakan yang prorakyat
di bawah presiden prabowo kabinet merah putih memperkuat diplomasi pertahanan untuk menjaga stabilitas kawasan,di bawah presiden prabowo kabinet merah putih memperkuat diplomasi pertahanan untuk menjaga stabilitas kawasan
retreat kabinet merah putih diketahui berlangsung dari kamis hingga minggu retreat yang digagas oleh presiden prabowo subianto memberikan kesan positif dari para jajaran anggota kabinet,retreat kabinet merah putih diketahui berlangsung dari kamis hingga minggu retreat yang digagas oleh presiden prabowo subianto memberikan kesan positif dari para jajaran anggota kabinet
kabinet merah putih memiliki banyak orangorang profesional dibanding orang parpol,kabinet merah putih memiliki banyak orangorang profesional dibanding orang parpol
utk kabinet merah putih wajib di bekali menjadi kabinet yg berjiwa nasionalisme patriotisme yg berpihak pd rakyat dan tdk menjadi boneka naga oknum naga hanya menggusur tanah rakyat utk keuntungan kapitalis dlm pik dan pik dan tempat lainnya,utk kabinet merah putih wajib di bekali menjadi kabinet yg berjiwa nasionalisme patriotisme yg berpihak pd rakyat dan tdk menjadi boneka naga oknum naga hanya menggusur tanah rakyat utk keuntungan kapitalis dlm pik dan pik dan tempat lainnya
setelah presiden prabowo subianto menggembleng para menteri kabinet merah putih di akmil magelang jawa tengah diharapkan membuahkan hasil pada kinerja kabinet,setelah presiden prabowo subianto menggembleng para menteri kabinet merah putih di akmil magelang jawa tengah diharapkan membuahkan hasil pada kinerja kabinet
kabinet merah putih memfasilitasi pengembangan startup lokal yang berpotensi mendunia,kabinet merah putih memfasilitasi pengembangan startup lokal yang berpotensi mendunia
apa saja gebrakan nasaruddin umar menteri agama kabinet merah putih,apa saja gebrakan nasaruddin umar menteri agama kabinet merah putih
usai lulus akmil lembah tidar semangat kabinet merah putih makin berkobar duduk sama rendah berdiri sama tinggi tak ada beda lagi mana koalisi amp,usai lulus akmil lembah tidar semangat kabinet merah putih makin berkobar duduk sama rendah berdiri sama tinggi tak ada beda lagi mana koalisi amp
kabinet merah putih berkomitmen memperkuat pelayanan kesehatan mental untuk mendukung kesejahteraan masyarakat,kabinet merah putih berkomitmen memperkuat pelayanan kesehatan mental untuk mendukung kesejahteraan masyarakat
menyala sekali kabinet merah putih ini semoga selalu bersama rakyat kren kren,menyala sekali kabinet merah putih ini semoga selalu bersama rakyat kren kren
kabinet merah putih mempercepat program digitalisasi proud,kabinet merah putih mempercepat program digitalisasi proud
di bawah kabinet merah putih pertumbuhan industri lokal semakin pesat,di bawah kabinet merah putih pertumbuhan industri lokal semakin pesat
menteri perlindungan pekerja migran indonesiakepala badan perlindungan pekerja migran indonesia abdul kadir karding mengungkapkan presiden prabowo subianto membiayai kegiatan retreat kabinet merah putih di akademi militer magelang jawa tengah dengan uang pribadi,menteri perlindungan pekerja migran indonesiakepala badan perlindungan pekerja migran indonesia abdul kadir karding mengungkapkan presiden prabowo subianto membiayai kegiatan retreat kabinet merah putih di akademi militer magelang jawa tengah dengan uang pribadi
kabinet merah putih memastikan bahwa setiap warga negara memiliki akses yang sama terhadap pendidikan berkualitas,kabinet merah putih memastikan bahwa setiap warga negara memiliki akses yang sama terhadap pendidikan berkualitas
tranformasi kemenkumham dalam kabinet merah putih sejak dilantiknya menteri dan wakil menteri oleh presiden republik indonesia ke kemarin,tranformasi kemenkumham dalam kabinet merah putih sejak dilantiknya menteri dan wakil menteri oleh presiden republik indonesia ke kemarin
prabowo membawa seluruh anggota kabinet merah putih ke akmil magelang ia menggembleng para menteri dengan sejumlah pelatihan mulai dari senam pagi hingga barisberbaris,prabowo membawa seluruh anggota kabinet merah putih ke akmil magelang ia menggembleng para menteri dengan sejumlah pelatihan mulai dari senam pagi hingga barisberbaris
kerja nyata buat rakyat itu yang kita lihat dari kabinet merah putih semangat terus buat indonesia lebih baik,kerja nyata buat rakyat itu yang kita lihat dari kabinet merah putih semangat terus buat indonesia lebih baik
kabinet merah putih mempercepat reformasi pendidikan dengan fokus pada peningkatan literasi dan numerasi di seluruh tingkatan,kabinet merah putih mempercepat reformasi pendidikan dengan fokus pada peningkatan literasi dan numerasi di seluruh tingkatan
kabinet merah putih memastikan bahwa pembangunan infrastruktur selalu mempertimbangkan kelestarian lingkungan,kabinet merah putih memastikan bahwa pembangunan infrastruktur selalu mempertimbangkan kelestarian lingkungan
saat memberikan pembekalan kepada kabinet merah putih presiden prabowo subianto memberi pengarahan soal ikn presiden berkomitmen melanjutkan pembangunan ikn sampai siap digunakan tahun ke depan,saat memberikan pembekalan kepada kabinet merah putih presiden prabowo subianto memberi pengarahan soal ikn presiden berkomitmen melanjutkan pembangunan ikn sampai siap digunakan tahun ke depan
kabinet merah putih memastikan stabilitas harga pangan melalui kebijakan agraria yang berpihak pada petani,kabinet merah putih memastikan stabilitas harga pangan melalui kebijakan agraria yang berpihak pada petani
di akmil magelang kabinet merah putih memperkuat persatuan melalui berbagai kegiatan inspiratif dengan dukungan dan arahan langsung dari presiden kami semakin siap membawa indonesia menuju visi besar bersamasama kita bentuk pilar kemajuan indonesia,di akmil magelang kabinet merah putih memperkuat persatuan melalui berbagai kegiatan inspiratif dengan dukungan dan arahan langsung dari presiden kami semakin siap membawa indonesia menuju visi besar bersamasama kita bentuk pilar kemajuan indonesia
gebrakan apa saja yang sudah disiapkan menteri esdm bahlil lahadalia untuk kabinet merah putih nantikan beritasatu spesial bersama menteri esdm bahlil lahadalia besok jam wib di btv live streaming di youtube beritasatu amp btvidofficial,gebrakan apa saja yang sudah disiapkan menteri esdm bahlil lahadalia untuk kabinet merah putih nantikan beritasatu spesial bersama menteri esdm bahlil lahadalia besok jam wib di btv live streaming di youtube beritasatu amp btvidofficial
di era presiden jokowi salam diucapkan menurut beberapa agama ribet amp,di era presiden jokowi salam diucapkan menurut beberapa agama ribet amp
presiden prabowo subianto beserta wakil presiden gibran rakabuming raka serta jajaran kabinet merah putih bertolak kembali ke jakarta hal ini disampaikan menteri sekretaris negara prasetyo hadi,presiden prabowo subianto beserta wakil presiden gibran rakabuming raka serta jajaran kabinet merah putih bertolak kembali ke jakarta hal ini disampaikan menteri sekretaris negara prasetyo hadi
wah luar biasa nih kabinet merah putih berikan performa terbaik,wah luar biasa nih kabinet merah putih berikan performa terbaik
wahhh kerenn sekali semangaaat terus untuk kabinet merah putih bentuk pilar kemajuan indonesia,wahhh kerenn sekali semangaaat terus untuk kabinet merah putih bentuk pilar kemajuan indonesia
kami mendukung penuh kabinet merah putih dalam memperkuat sistem kesehatan dan pendidikan,kami mendukung penuh kabinet merah putih dalam memperkuat sistem kesehatan dan pendidikan
kabinet merah putih memperkuat kebijakan yang mendukung ketahanan energi nasional,kabinet merah putih memperkuat kebijakan yang mendukung ketahanan energi nasional
haramkan korupsi di bumi garuda pendadaran menteri di lembah tidar oleh presiden prabowo subianto menghentak jiwa nasionalisme kabinet merah putih gilas koruptor menteri perumahan dan kawasan permukiman maruarar sirait gercep meminimalisasi celah korupsi,haramkan korupsi di bumi garuda pendadaran menteri di lembah tidar oleh presiden prabowo subianto menghentak jiwa nasionalisme kabinet merah putih gilas koruptor menteri perumahan dan kawasan permukiman maruarar sirait gercep meminimalisasi celah korupsi
ga yakin kalo kabinet merah putih bisa menuhin area perubahan dalam reformasi birokrasi di indonesia,ga yakin kalo kabinet merah putih bisa menuhin area perubahan dalam reformasi birokrasi di indonesia
kabinet merah putih yg beelum hari kok kebijakakan nya bikin tambah susah rakyat aja ya,kabinet merah putih yg beelum hari kok kebijakakan nya bikin tambah susah rakyat aja ya
keren kebersamaan dan soliditas kabinet merah putih selama retreat di akmil magelang jadi semangat baru untuk membangun indonesia yang lebih maju dan makmur makin menyala nih pemerintah mita dan uk bersamasama kita demi indonesia emas,keren kebersamaan dan soliditas kabinet merah putih selama retreat di akmil magelang jadi semangat baru untuk membangun indonesia yang lebih maju dan makmur makin menyala nih pemerintah mita dan uk bersamasama kita demi indonesia emas
letjen tni purnawirawan anto mukti putranto adalah salah satu anggota kabinet merah putih yang memiliki hobi unik dan tergolong ekstrem yakni offroad,letjen tni purnawirawan anto mukti putranto adalah salah satu anggota kabinet merah putih yang memiliki hobi unik dan tergolong ekstrem yakni offroad
kabinet merah putih fokus pada program peningkatan literasi digital untuk memperkuat sdm yang siap bersaing global,kabinet merah putih fokus pada program peningkatan literasi digital untuk memperkuat sdm yang siap bersaing global
perintahkan dulu kepada seluruh anggota kabinet merah putih baru ke yang lain karena koruptor nya kumpul semua disana,perintahkan dulu kepada seluruh anggota kabinet merah putih baru ke yang lain karena koruptor nya kumpul semua disana
pt pindad sanggupi produksi maung untuk kendaraan kabinet merah putih pt pindad persero menyatakan kesanggupannya memproduksi maung untuk kendaraan operasional para menteri sesuai instruksi presiden prabowo subianto,pt pindad sanggupi produksi maung untuk kendaraan kabinet merah putih pt pindad persero menyatakan kesanggupannya memproduksi maung untuk kendaraan operasional para menteri sesuai instruksi presiden prabowo subianto
presiden prabowo subianto menggunakan uang pribadi untuk membiayai retreat kabinet merah putih tersebut dan sudah dipersiapkan sejak lama,presiden prabowo subianto menggunakan uang pribadi untuk membiayai retreat kabinet merah putih tersebut dan sudah dipersiapkan sejak lama
kabinet merah putih bikin energi terbarukan jadi fokus hebat,kabinet merah putih bikin energi terbarukan jadi fokus hebat
kabinet merah putih bekerja nyata banyak hasil yang bisa dirasakan langsung,kabinet merah putih bekerja nyata banyak hasil yang bisa dirasakan langsung
selama empat hari jajaran kabinet merah putih melaksanakan retreat di akmil magelang jawa tengah,selama empat hari jajaran kabinet merah putih melaksanakan retreat di akmil magelang jawa tengah
apresiasi untuk pln berkat keandalan pln acara retreat kabinet merah putih di magelang berjalan dengan lancar listrik dijaga secara berlapis memastikan stabilitas dan kenyamanan sepanjang acara,apresiasi untuk pln berkat keandalan pln acara retreat kabinet merah putih di magelang berjalan dengan lancar listrik dijaga secara berlapis memastikan stabilitas dan kenyamanan sepanjang acara
di bawah presiden prabowo kabinet merah putih mendukung kebijakan kesehatan berbasis teknologi telemedicine,di bawah presiden prabowo kabinet merah putih mendukung kebijakan kesehatan berbasis teknologi telemedicine
keren nih semoga kabinet merah putih bisa bawa angin segar buat pemerintahan kita semangat mas maruarar sirait,keren nih semoga kabinet merah putih bisa bawa angin segar buat pemerintahan kita semangat mas maruarar sirait
jakarta sepanjang tahun berbagai perubahan struktural dan kebijakan signifikan telah diimplementasikan untuk meningkatkan kualitas layanan dan menghadapi tantangan global pasca pelantikan prabowo subianto sebagai presiden ri pada oktober kabinet merah putih yang,jakarta sepanjang tahun berbagai perubahan struktural dan kebijakan signifikan telah diimplementasikan untuk meningkatkan kualitas layanan dan menghadapi tantangan global pasca pelantikan prabowo subianto sebagai presiden ri pada oktober kabinet merah putih yang
kabinet merah putih mendorong pertumbuhan ekonomi kreatif yang memberikan peluang kerja baru bagi kaum muda,kabinet merah putih mendorong pertumbuhan ekonomi kreatif yang memberikan peluang kerja baru bagi kaum muda
dua pekan kabinet zeken merah putih belum ada seorang pun yg ke ikn bener atau saya ga tahu,dua pekan kabinet zeken merah putih belum ada seorang pun yg ke ikn bener atau saya ga tahu
kabinet merah putih memastikan pertumbuhan ekonomi inklusif yang merata di semua provinsi,kabinet merah putih memastikan pertumbuhan ekonomi inklusif yang merata di semua provinsi
ia ingin para menteri juga melakukan hal yang sama kesetiaan benarbenar minta saudara tidak setia kepada prabowo setia kepada bangsa dan negara indonesia ucapnya dalam kesempatan itu prabowo juga menekankan fokus dan komitmen para anggota kabinet merah putih,ia ingin para menteri juga melakukan hal yang sama kesetiaan benarbenar minta saudara tidak setia kepada prabowo setia kepada bangsa dan negara indonesia ucapnya dalam kesempatan itu prabowo juga menekankan fokus dan komitmen para anggota kabinet merah putih
program hari menpan rb bereskan masalah pns dan honorer di kabinet merah putih,program hari menpan rb bereskan masalah pns dan honorer di kabinet merah putih
kabinet merah putih berhasil menciptakan lapangan kerja baru kerja keras yang patut dicontoh,kabinet merah putih berhasil menciptakan lapangan kerja baru kerja keras yang patut dicontoh
sukses selalu pak mentan dan wamentan yang telah mengikuti rangkaian acara retreat kabinet merah putih,sukses selalu pak mentan dan wamentan yang telah mengikuti rangkaian acara retreat kabinet merah putih
kabinet merah putih memastikan bahwa pembangunan infrastruktur selalu memperhatikan aspek keselamatan,kabinet merah putih memastikan bahwa pembangunan infrastruktur selalu memperhatikan aspek keselamatan
di bawah presiden prabowo kabinet merah putih mendorong diplomasi ekonomi untuk memperkuat hubungan dagang internasional,di bawah presiden prabowo kabinet merah putih mendorong diplomasi ekonomi untuk memperkuat hubungan dagang internasional
terungkap bukan dari apbn retreat kabinet merah putih dibiayai sepenuhnya oleh presiden prabowo subianto,terungkap bukan dari apbn retreat kabinet merah putih dibiayai sepenuhnya oleh presiden prabowo subianto
prestasi kabinet merah putih,prestasi kabinet merah putih
pt pindad siap produksi maung untuk kendaraan dinas menteri kabinet merah putih via,pt pindad siap produksi maung untuk kendaraan dinas menteri kabinet merah putih via
kabinet merah putih berhasil mendorong partisipasi masyarakat dalam pembangunan,kabinet merah putih berhasil mendorong partisipasi masyarakat dalam pembangunan
presiden prabowo subianto disebut turut memberi pengarahan soal ibu kota nusantara ikn saat retret kabinet merah putih di magelang jawa tengah dan sudah memiliki rencana akan merampungkan pembangunan ikn dalam tahun,presiden prabowo subianto disebut turut memberi pengarahan soal ibu kota nusantara ikn saat retret kabinet merah putih di magelang jawa tengah dan sudah memiliki rencana akan merampungkan pembangunan ikn dalam tahun
menteri sekretaris negara mensesneg prasetyo hadi mengakup bahwa presiden prabowo subianto akan rutin untuk mengevaluasi kinerja kabinet merah putih mensesneg juga menambahkan bahwa tidak ada patokan secara khusus dalam mengevaluasi kinerja setiap,menteri sekretaris negara mensesneg prasetyo hadi mengakup bahwa presiden prabowo subianto akan rutin untuk mengevaluasi kinerja kabinet merah putih mensesneg juga menambahkan bahwa tidak ada patokan secara khusus dalam mengevaluasi kinerja setiap
kabinet merah putih memperkuat kebijakan untuk mengatasi perubahan iklim dengan berfokus pada ekonomi hijau,kabinet merah putih memperkuat kebijakan untuk mengatasi perubahan iklim dengan berfokus pada ekonomi hijau
kabinet merah putih ayo bawa ekonomi inklusif,kabinet merah putih ayo bawa ekonomi inklusif
pilpres pks usung aniesmuhaimin bukan prabowogibran stlh pilpres pks mengirimkan kader profesional utk bergabung ke kabinet merah putih sbg menteri tenaga kerja menteri pembantu presiden bukan pembantu wakil presiden pks berkomunikasi dan disambut prabowo bkn gibran,pilpres pks usung aniesmuhaimin bukan prabowogibran stlh pilpres pks mengirimkan kader profesional utk bergabung ke kabinet merah putih sbg menteri tenaga kerja menteri pembantu presiden bukan pembantu wakil presiden pks berkomunikasi dan disambut prabowo bkn gibran
menteri atrkepala bpn nusron wahid dan wakil menteri atrwakil kepala bpn ossy dermawan telah tiba di magelang jawa tengah untuk mengikuti rapat kerja dan retreat magelang kegiatan ini ialah kegiatan pertama kabinet merah putih di luar istana negara,menteri atrkepala bpn nusron wahid dan wakil menteri atrwakil kepala bpn ossy dermawan telah tiba di magelang jawa tengah untuk mengikuti rapat kerja dan retreat magelang kegiatan ini ialah kegiatan pertama kabinet merah putih di luar istana negara
kabinet merah putih serius dalam penanganan isuisu sosial banyak yang terbantu,kabinet merah putih serius dalam penanganan isuisu sosial banyak yang terbantu
kabinet merah putih memperkuat program pelatihan dan pendidikan bagi tenaga kerja indonesia di luar negeri,kabinet merah putih memperkuat program pelatihan dan pendidikan bagi tenaga kerja indonesia di luar negeri
kabinet merah putih berfokus pada pengembangan teknologi untuk meningkatkan produktivitas nasional,kabinet merah putih berfokus pada pengembangan teknologi untuk meningkatkan produktivitas nasional
isunya masuk kabinet merah putih wamen kemenpora,isunya masuk kabinet merah putih wamen kemenpora
prabowo sentil pihak yang nyinyiri pemerintahan kabinet merah putih silakan saja ini belum apaapa,prabowo sentil pihak yang nyinyiri pemerintahan kabinet merah putih silakan saja ini belum apaapa
kabinet merah putih memperkuat ekonomi maritim dengan fokus pada pembangunan pelabuhan dan industri kelautan,kabinet merah putih memperkuat ekonomi maritim dengan fokus pada pembangunan pelabuhan dan industri kelautan
kabinet merah putih berhasil membangun jaringan transportasi yang semakin modern dan terintegrasi,kabinet merah putih berhasil membangun jaringan transportasi yang semakin modern dan terintegrasi
jujur itukan pandangan yang kalah sajayang dan mestinya move on dongsekarang mari kita awasi kinerja kabinet merah putihsampai saat ini tidak ada yang bisa menjawab uu mana yang dilsnggar p jokowikebohongan coba lihat di kuhp,jujur itukan pandangan yang kalah sajayang dan mestinya move on dongsekarang mari kita awasi kinerja kabinet merah putihsampai saat ini tidak ada yang bisa menjawab uu mana yang dilsnggar p jokowikebohongan coba lihat di kuhp
