Cleaned_Tweet,Segmented_Text
hilirisasi dalam sektor energi dan sumber daya mineral esdm adalah strategi utama untuk meningkatkan nilai tambah hilirisasi nikel misalnya dari nilai ekspor bahan mentah sebesar usd miliar pada menjadi usd miliar pada saya mengapresiasi kementerian esdm,hilirisasi dalam sektor energi dan sumber daya mineral esdm adalah strategi utama untuk meningkatkan nilai tambah hilirisasi nikel misalnya dari nilai ekspor bahan mentah sebesar usd miliar pada menjadi usd miliar pada saya mengapresiasi kementerian esdm
menteri pertanian andi amran sulaiman sejak jadi menteri prabowo berani menindak para pengusaha busuk yang dibecking penguasahayo jalan terus saatnya menindak habis para koruptor,menteri pertanian andi amran sulaiman sejak jadi menteri prabowo berani menindak para pengusaha busuk yang dibecking penguasahayo jalan terus saatnya menindak habis para koruptor
tenang ada allah tenang ada allah tenang ada allah tenang ada allah tenang ada allah tenang ada allah tenang ada allah tenang ada allah tenang ada allah tenang ada allah tenang ada allah tenang ada allah tenang ada allah tenang ada allah,tenang ada allah tenang ada allah tenang ada allah tenang ada allah tenang ada allah tenang ada allah tenang ada allah tenang ada allah tenang ada allah tenang ada allah tenang ada allah tenang ada allah tenang ada allah tenang ada allah
gimana mau jadi petani kalau orangorang yang secara turuntemurun penghidupannya dari bertani dan berkebun saja akhirnya harus kehilangan mata pencaharian karena hutan atau tanahnya dirampas,gimana mau jadi petani kalau orangorang yang secara turuntemurun penghidupannya dari bertani dan berkebun saja akhirnya harus kehilangan mata pencaharian karena hutan atau tanahnya dirampas
sobatani mentan amran mengungkapkan kebanggaannya atas tuntasnya optimasi lahan ha di merauke papua selatanmentan amran pun optimis untuk menjadikan wilayah ini sebagai laboratorium raksasa pertanian indonesia amp menekankan untuk memperkuat kelembagaan petani milenial,sobatani mentan amran mengungkapkan kebanggaannya atas tuntasnya optimasi lahan ha di merauke papua selatanmentan amran pun optimis untuk menjadikan wilayah ini sebagai laboratorium raksasa pertanian indonesia amp menekankan untuk memperkuat kelembagaan petani milenial
melemahkan kpk menggencarkan ekspor pasir mewajarkan impor sembako melanggengkan praktik kkn melancarkan deforestasi menormalisasi suapgratifikasi menyengsarakan rakyat kecil mempersulit akses pendidikan membodohi publik,melemahkan kpk menggencarkan ekspor pasir mewajarkan impor sembako melanggengkan praktik kkn melancarkan deforestasi menormalisasi suapgratifikasi menyengsarakan rakyat kecil mempersulit akses pendidikan membodohi publik
dari semua jajaran menteri bidang ekonomi dan pembangunan ada bbrpa catatan yg problematik dody hanggodo menteri pu posisi yg amat penting tapi rekam jejaknya tidak jelas agak pesimis pdhal pos ini amat krusial bagi pembangunan infra menhub dudy purwagandhi menhub,dari semua jajaran menteri bidang ekonomi dan pembangunan ada bbrpa catatan yg problematik dody hanggodo menteri pu posisi yg amat penting tapi rekam jejaknya tidak jelas agak pesimis pdhal pos ini amat krusial bagi pembangunan infra menhub dudy purwagandhi menhub
sobatani pada kunjungan kerja mentan amran di kampung telaga sari kab merauke lalu mentan mendorong para generasi milenial untuk terjun di sektor pertanian menggunakan teknologi tinggi dan menegaskan bahwa kementerian pertanian mengoptimalkan hal yaitu,sobatani pada kunjungan kerja mentan amran di kampung telaga sari kab merauke lalu mentan mendorong para generasi milenial untuk terjun di sektor pertanian menggunakan teknologi tinggi dan menegaskan bahwa kementerian pertanian mengoptimalkan hal yaitu
sobatani pada kunjungan kerjanya di pasuruan jawa timur kamis lalu menteri pertanian melakukan peninjauan di koperasi usaha tani ternak suka makmur dalam peninjauannya mentan amran menyampaikan bahwa industri pengolahan susu nasional harus cont,sobatani pada kunjungan kerjanya di pasuruan jawa timur kamis lalu menteri pertanian melakukan peninjauan di koperasi usaha tani ternak suka makmur dalam peninjauannya mentan amran menyampaikan bahwa industri pengolahan susu nasional harus cont
sobatani kepolisian ri bersama kementerian pertanian siap mendukung program presiden ri mencapai ketahanan pangan amp swasembada pangan dalam waktu yang seingkatsingkatnya untuk mendukung program presiden ri mentan membutuhkan anak muda,sobatani kepolisian ri bersama kementerian pertanian siap mendukung program presiden ri mencapai ketahanan pangan amp swasembada pangan dalam waktu yang seingkatsingkatnya untuk mendukung program presiden ri mentan membutuhkan anak muda
kabinet merah putih asoi  kemenhan jay idzes kemenhub sandy walsh kementrian esdm nathan tjoeaon kemenpora maarten paes kemenkominfodigital jens raven kemenlutkan budiono siregar kemenlu mees hilgers kemendagri hokky caraka selamat bertugas,kabinet merah putih asoi kemenhan jay idzes kemenhub sandy walsh kementrian esdm nathan tjoeaon kemenpora maarten paes kemenkominfodigital jens raven kemenlutkan budiono siregar kemenlu mees hilgers kemendagri hokky caraka selamat bertugas
alhamdulillah kemarin saya resmi dilantik sebagai menteri koordinator bidang infrastruktur dan pembangunan kewilayahan segera setelah pelantikan ini saya akan turun langsung ke lapangan guna mempelajari dan memahami lebih dalam tantangan serta masalah yang dihadapi sebagai,alhamdulillah kemarin saya resmi dilantik sebagai menteri koordinator bidang infrastruktur dan pembangunan kewilayahan segera setelah pelantikan ini saya akan turun langsung ke lapangan guna mempelajari dan memahami lebih dalam tantangan serta masalah yang dihadapi sebagai
menteri pertanian amran sulaiman mengatakan temuan kasus pupuk palsu yang melibatkan empat perusahaan dan pegawai di kementeriannya berpotensi merugikan petani hingga rp triliun dan merugikan negara hingga rp miliar,menteri pertanian amran sulaiman mengatakan temuan kasus pupuk palsu yang melibatkan empat perusahaan dan pegawai di kementeriannya berpotensi merugikan petani hingga rp triliun dan merugikan negara hingga rp miliar
sobatani penandatanganan pakta integritas kementerian pertanian selasa merupakan salah satu langkah nyata untuk mewujudkan pemerintahan yang bersih dan transparan menteri pertanian menegaskan pentingnya integritas sebagai landasan utama,sobatani penandatanganan pakta integritas kementerian pertanian selasa merupakan salah satu langkah nyata untuk mewujudkan pemerintahan yang bersih dan transparan menteri pertanian menegaskan pentingnya integritas sebagai landasan utama
sobatani minggu menteri pertanian mendampingi presiden ri meninjau langsung jalannya percepatan swasembada pangan di kampung telagasari distrik kurik merauke ini merupakan kunjungan kerja pertama presiden prabowo usai dilantik sebagai,sobatani minggu menteri pertanian mendampingi presiden ri meninjau langsung jalannya percepatan swasembada pangan di kampung telagasari distrik kurik merauke ini merupakan kunjungan kerja pertama presiden prabowo usai dilantik sebagai
menteri amran copot direktur kementan diduga terima suap rp juta,menteri amran copot direktur kementan diduga terima suap rp juta
hari ini adalah momen bersejarah di mana kita menyaksikan peresmian istana negara di ibu kota nusantara sebuah simbol menuju indonesia yang lebih maju di abad ke atas nama kementerian atrbpn secara langsung saya menyerahkan sertipikat hak pakai no dengan nomor induk,hari ini adalah momen bersejarah di mana kita menyaksikan peresmian istana negara di ibu kota nusantara sebuah simbol menuju indonesia yang lebih maju di abad ke atas nama kementerian atrbpn secara langsung saya menyerahkan sertipikat hak pakai no dengan nomor induk
sobatani menteri pertanian senin berhasil mempertemukan peternak sapi perah pengepul dan industri pengolahan susu untuk mencari solusi bersama atas persoalan kurang terserapnya susu oleh industri beberapa waktu belakangan ini,sobatani menteri pertanian senin berhasil mempertemukan peternak sapi perah pengepul dan industri pengolahan susu untuk mencari solusi bersama atas persoalan kurang terserapnya susu oleh industri beberapa waktu belakangan ini
sobatani pada rabu lalu menteri pertanian dan menteri desa dan daerah tertinggal menandatangani kesepakatan bersama untuk bersinergi dalam gerakan nasional pangan merahputih yang bertujuan untuk menjemput kembali cont,sobatani pada rabu lalu menteri pertanian dan menteri desa dan daerah tertinggal menandatangani kesepakatan bersama untuk bersinergi dalam gerakan nasional pangan merahputih yang bertujuan untuk menjemput kembali cont
petang tadi mempengerusikan mesyuarat jawatankuasa kabinet mengenai dasar keterjaminan makanan negara bil iaitu platform tertinggi bagi kerajaan untuk menekuni isu terkait sekuriti makanan serta kebajikan petani dan pesawah mesyuarat antara lain memberi tumpuan kepada,petang tadi mempengerusikan mesyuarat jawatankuasa kabinet mengenai dasar keterjaminan makanan negara bil iaitu platform tertinggi bagi kerajaan untuk menekuni isu terkait sekuriti makanan serta kebajikan petani dan pesawah mesyuarat antara lain memberi tumpuan kepada
sobatani di bawah kepemimpinan presiden harapan amp citacita petani indonesia perlahan terwujud para petani berterimakasih kepada presiden jokowi amp mentan amran atas bantuan yang diberikan mulai dari pupuk bersubsidi alat mesin pertanian hingga pompanisasi,sobatani di bawah kepemimpinan presiden harapan amp citacita petani indonesia perlahan terwujud para petani berterimakasih kepada presiden jokowi amp mentan amran atas bantuan yang diberikan mulai dari pupuk bersubsidi alat mesin pertanian hingga pompanisasi
sobatani di bawah kepemimpinan presiden amp presiden terpilih nantinya indonesia fokus untuk bertransformasi dari pertanian tradisional ke modern salah satunya lewat upaya optimasi lahan dan cetak sawah baru yang dijalankan oleh kementerian pertanian,sobatani di bawah kepemimpinan presiden amp presiden terpilih nantinya indonesia fokus untuk bertransformasi dari pertanian tradisional ke modern salah satunya lewat upaya optimasi lahan dan cetak sawah baru yang dijalankan oleh kementerian pertanian
para petani di kampung telagasari distrik kurik merauke menyambut baik kehadiran presiden dan menteri pertanian sebagai wujud komitmen pemerintah dalam percepatan swasembada pangan berkelanjutan selengkapnya simak video berikut ya sob,para petani di kampung telagasari distrik kurik merauke menyambut baik kehadiran presiden dan menteri pertanian sebagai wujud komitmen pemerintah dalam percepatan swasembada pangan berkelanjutan selengkapnya simak video berikut ya sob
sobatani menteri pertanian senin menemui jaksa agung di kantor kejaksaan agung jakarta pertemuan ini dilangsungkan guna membahas kerjasama kementan dan kejaksaan agung dalam menindaktegas penyelewengan di sektor pangan dan pertanian,sobatani menteri pertanian senin menemui jaksa agung di kantor kejaksaan agung jakarta pertemuan ini dilangsungkan guna membahas kerjasama kementan dan kejaksaan agung dalam menindaktegas penyelewengan di sektor pangan dan pertanian
sobatani kepolisian ri bersama kementerian pertanian siap mendukung program presiden ri mencapai ketahanan pangan dan indonesia swasembada pangan dalam waktu yang seingkatsingkatnya untuk mendukung program presiden ri mentan membutuhkan,sobatani kepolisian ri bersama kementerian pertanian siap mendukung program presiden ri mencapai ketahanan pangan dan indonesia swasembada pangan dalam waktu yang seingkatsingkatnya untuk mendukung program presiden ri mentan membutuhkan
pak menteri pertanian andi amran sulaiman dan saya di kementerian bumn mendukung dan memastikan untuk bersinergi mewujudkan visi bapak presiden prabowo subianto untuk indonesia swasembada pangan secepatnya dan menjadi lumbung pangan dunia hari ini saya bersama bulog logistik,pak menteri pertanian andi amran sulaiman dan saya di kementerian bumn mendukung dan memastikan untuk bersinergi mewujudkan visi bapak presiden prabowo subianto untuk indonesia swasembada pangan secepatnya dan menjadi lumbung pangan dunia hari ini saya bersama bulog logistik
tadi siang saya bersama lima menteri teknis di dalam yaitu menteri atrbpn menteri pekerjaan umum menteri perumahan dan kawasan permukiman menteri transmigrasi dan menteri perhubungan menghadap presiden turut hadir menteri sekretaris negara dan seskab kami,tadi siang saya bersama lima menteri teknis di dalam yaitu menteri atrbpn menteri pekerjaan umum menteri perumahan dan kawasan permukiman menteri transmigrasi dan menteri perhubungan menghadap presiden turut hadir menteri sekretaris negara dan seskab kami
sobatani menteri pertanian ri menyampaikan komitmen kementerian pertanian untuk menjadi kementerian yang transparan akuntabel dan bersihwujud dari upaya tersebut adalah menjadikan kementerian pertanian yang informatif selama tahun berturut turut cont,sobatani menteri pertanian ri menyampaikan komitmen kementerian pertanian untuk menjadi kementerian yang transparan akuntabel dan bersihwujud dari upaya tersebut adalah menjadikan kementerian pertanian yang informatif selama tahun berturut turut cont
sobatani setelah berhasil mempertemukan produsen susu sapi lokal dengan perwakilan industri beberapa waktu lalu mentan melakukan kunjungan kerja ke pasuruan jawa timur untuk menghadiri gerakan peningkatan produksi susu segar dalam negeri cont,sobatani setelah berhasil mempertemukan produsen susu sapi lokal dengan perwakilan industri beberapa waktu lalu mentan melakukan kunjungan kerja ke pasuruan jawa timur untuk menghadiri gerakan peningkatan produksi susu segar dalam negeri cont
sobatani doa dan dukungan untuk tercapainya swasembada pangan di indonesia terus berdatangan dari berbagai pihak termasuk dari ustadz maulana mentan ri yang bertemu dengan ustadz maulana usai memberi pembekalan pendidikan reguler dikreg,sobatani doa dan dukungan untuk tercapainya swasembada pangan di indonesia terus berdatangan dari berbagai pihak termasuk dari ustadz maulana mentan ri yang bertemu dengan ustadz maulana usai memberi pembekalan pendidikan reguler dikreg
penghapusan utang petani dan nelayan tamparan keras untuk kebijakan jokowi,penghapusan utang petani dan nelayan tamparan keras untuk kebijakan jokowi
sobatani pada kamis menteri pertanian memaparkan strategi untuk mencapai swasembada pangan dalam rapat koordinasi nasional pemerintah pusat dan daerah di sentul international convention center sicc sesuai arahan dari presiden ri cont,sobatani pada kamis menteri pertanian memaparkan strategi untuk mencapai swasembada pangan dalam rapat koordinasi nasional pemerintah pusat dan daerah di sentul international convention center sicc sesuai arahan dari presiden ri cont
kementan kok selucu ini ajak raffi milenialkan petani raffi nya bingung petaninya jg bingung kan lebih tepat ipb amp fakultas pertanian yg jd sparing partner amp sumber masukannya kementan,kementan kok selucu ini ajak raffi milenialkan petani raffi nya bingung petaninya jg bingung kan lebih tepat ipb amp fakultas pertanian yg jd sparing partner amp sumber masukannya kementan
dari bendungan sidan lanjut meninjau pelaksanaan inpres jalan desa sepanjang km di kabupaten bangli jalan dari yang lebarnya m kini menjadi m dengan ketebalan aspal cm selesainya jalan inpres ini telah dirasakan manfaatnya langsung oleh masyarakat dengan,dari bendungan sidan lanjut meninjau pelaksanaan inpres jalan desa sepanjang km di kabupaten bangli jalan dari yang lebarnya m kini menjadi m dengan ketebalan aspal cm selesainya jalan inpres ini telah dirasakan manfaatnya langsung oleh masyarakat dengan
sobatani yuk simak penjelasan mentan soal penghasilan petani milenial rp juta perbulan mentan amran menyampaikan bahwa kementan ingin membina milenial menjadi enterpreneur melalui cluster pertanian modern untuk menarik generasi milenial amp generasi z,sobatani yuk simak penjelasan mentan soal penghasilan petani milenial rp juta perbulan mentan amran menyampaikan bahwa kementan ingin membina milenial menjadi enterpreneur melalui cluster pertanian modern untuk menarik generasi milenial amp generasi z
menteri pertanian andi amran sulaiman mencopot tiga orang pejabat kementerian pertanian yang diduga korupsi proyek mencapai rp miliar kasus ini sedang ditangani penegak hukum korupsi itu berawal dari oknum swasta yang meminta proyek dari kementerian pertanian kemudian,menteri pertanian andi amran sulaiman mencopot tiga orang pejabat kementerian pertanian yang diduga korupsi proyek mencapai rp miliar kasus ini sedang ditangani penegak hukum korupsi itu berawal dari oknum swasta yang meminta proyek dari kementerian pertanian kemudian
sobatani menteri pertanian dan panglima tni agus subiyanto pada kamis melakukan kunjungan kerja bersama di daerah kabupaten pemalang untuk berkolaborasi melakukan akselerasi swasembada pangan selengkapnya simak video berikut ini ya sob,sobatani menteri pertanian dan panglima tni agus subiyanto pada kamis melakukan kunjungan kerja bersama di daerah kabupaten pemalang untuk berkolaborasi melakukan akselerasi swasembada pangan selengkapnya simak video berikut ini ya sob
sobatani untuk menindak lanjuti gagasan besar presiden ri yaitu swasembada pangan secepatnya mentan bersama menteri pekerjaan umum dody hanggodo melaksanakan rapat koordinasi optimalisasi pemanfaatan bendungan untuk irigasi pertanian jumat,sobatani untuk menindak lanjuti gagasan besar presiden ri yaitu swasembada pangan secepatnya mentan bersama menteri pekerjaan umum dody hanggodo melaksanakan rapat koordinasi optimalisasi pemanfaatan bendungan untuk irigasi pertanian jumat
sobatani di tengah upaya pemerintah mewujudkan swasembada pangan dengan meningkatkan produksi beras optimalisasi lahan baik di lahan rawa hingga lahan pesisir terus diupayakan oleh kementerian pertanian,sobatani di tengah upaya pemerintah mewujudkan swasembada pangan dengan meningkatkan produksi beras optimalisasi lahan baik di lahan rawa hingga lahan pesisir terus diupayakan oleh kementerian pertanian
sobatani tahun kepemimpinan presiden sejak telah menorehkan berbagai prestasi termasuk di bidang pertanian kebijakan pemerintah melalui kementan yang manfaatnya dirasakan betul oleh petani ialah penambahan alokasi pupuk bersubsidi amp penyaluran pompanisasi,sobatani tahun kepemimpinan presiden sejak telah menorehkan berbagai prestasi termasuk di bidang pertanian kebijakan pemerintah melalui kementan yang manfaatnya dirasakan betul oleh petani ialah penambahan alokasi pupuk bersubsidi amp penyaluran pompanisasi
sobatani dalam kunjungan kerja menteri pertanian di bone sulawesi selatan pada lalu mentan menekankan potensi bonus demografi di indonesia yakni sebesar generasi muda yang dapat dimaksimalkan untuk membangun pertanian indonesia,sobatani dalam kunjungan kerja menteri pertanian di bone sulawesi selatan pada lalu mentan menekankan potensi bonus demografi di indonesia yakni sebesar generasi muda yang dapat dimaksimalkan untuk membangun pertanian indonesia
sobatani pemerintah melalui mentan memberikan bantuan alsintan gratis yaitu combine harvester seharga juta kepada kelompok petani di lhoksukon aceh utarahal ini dikarenakan mentan amran menemukan kelompok tersebut masih menggunakan sabit untuk bertani,sobatani pemerintah melalui mentan memberikan bantuan alsintan gratis yaitu combine harvester seharga juta kepada kelompok petani di lhoksukon aceh utarahal ini dikarenakan mentan amran menemukan kelompok tersebut masih menggunakan sabit untuk bertani
sobatani mentan amran menegaskan industri pengolahan susu nasional dapat menyerap susu dari peternak lokal di seluruh indonesia mentan amran pun mengingatkan agar para peternak lokal tetap menjaga kualitas susu yang dihasilkan demi kesehatan amp kesejahteraan generasi kedepan,sobatani mentan amran menegaskan industri pengolahan susu nasional dapat menyerap susu dari peternak lokal di seluruh indonesia mentan amran pun mengingatkan agar para peternak lokal tetap menjaga kualitas susu yang dihasilkan demi kesehatan amp kesejahteraan generasi kedepan
pertanian bekerja sepenuh hati membangun ketahanan pangan dalam negeri terima kasih presiden ke republik indonesia bapak joko widodo yang turut membangun pertanian di indonesia selama tahun terakhir,pertanian bekerja sepenuh hati membangun ketahanan pangan dalam negeri terima kasih presiden ke republik indonesia bapak joko widodo yang turut membangun pertanian di indonesia selama tahun terakhir
sobatani bertani di zaman ini menjadi lebih mudah amp efisien dengan menggunakan alsintan berteknologi tinggi pemerintah melalui kementan memberikan bantuan alsintan gratis melalui ditjen prasarana dan sarana pertanian yang bisa didapatkan oleh poktan atau gapoktan yang aktif,sobatani bertani di zaman ini menjadi lebih mudah amp efisien dengan menggunakan alsintan berteknologi tinggi pemerintah melalui kementan memberikan bantuan alsintan gratis melalui ditjen prasarana dan sarana pertanian yang bisa didapatkan oleh poktan atau gapoktan yang aktif
mengenal pola kemitraan bisnis pertanian modern kementan menghadirkan brigade pangan sebagai inovasi untuk mewujudkan pertanian modern yang berkelanjutan dengan pola kemitraan garap lahan tahunan garap lahan musim gadu kerjasama operasional agribisnis koa,mengenal pola kemitraan bisnis pertanian modern kementan menghadirkan brigade pangan sebagai inovasi untuk mewujudkan pertanian modern yang berkelanjutan dengan pola kemitraan garap lahan tahunan garap lahan musim gadu kerjasama operasional agribisnis koa
sobatani mentan kembali ke papua untuk mengecek progres cetak sawah baru juga pelaksanaan brigade pangan di distrik wanam merauke papua selatan sesuai arahan presiden prabowo subianto indonesia diharapkan menjadi negara yang berdaulat cont,sobatani mentan kembali ke papua untuk mengecek progres cetak sawah baru juga pelaksanaan brigade pangan di distrik wanam merauke papua selatan sesuai arahan presiden prabowo subianto indonesia diharapkan menjadi negara yang berdaulat cont
seniman sastrawan peneliti individu yg mampu berpikir ketika disodori tema kedaulatan pangan kenapa kita gagal mencapai kedaulatan pangan oh karena kebijakan yg tidak berpihak oh karena ada perselingkuhan antar elite oh karena ada penguasa yg korup dst,seniman sastrawan peneliti individu yg mampu berpikir ketika disodori tema kedaulatan pangan kenapa kita gagal mencapai kedaulatan pangan oh karena kebijakan yg tidak berpihak oh karena ada perselingkuhan antar elite oh karena ada penguasa yg korup dst
malam harinya saya dan mas melakukan serah terima jabatan menteri dan wakil menteri kepada gus nusroh wahid juga wamen mas selamat bertugas kepada menteri dan wamen atrbpn saya yakin di bawah kepemimpinan keduanya dapat,malam harinya saya dan mas melakukan serah terima jabatan menteri dan wakil menteri kepada gus nusroh wahid juga wamen mas selamat bertugas kepada menteri dan wamen atrbpn saya yakin di bawah kepemimpinan keduanya dapat
raffi ahmad dimasukin karena utusan khusus fasilitasnya setara menteri,raffi ahmad dimasukin karena utusan khusus fasilitasnya setara menteri
sobatani ada yang sarapan bareng di andara nihh sambil berbincang soal memaksimalkan peran generasi muda di bidang pertanianwamentan amp utusan khusus presiden bidang pembinaan generasi muda dan pekerja seni akan memiliki kolaborasi baru cont,sobatani ada yang sarapan bareng di andara nihh sambil berbincang soal memaksimalkan peran generasi muda di bidang pertanianwamentan amp utusan khusus presiden bidang pembinaan generasi muda dan pekerja seni akan memiliki kolaborasi baru cont
kabar gembira bagi para petani di seluruh indonesia pemerintah melalui kementerian koordinator bidang pangan amp kementerian pertanian telah memangkas regulasi yang dinilai memperlambat alur distribusi pupuk bersubsidi dengan adanya kebijakan ini diharapkan petani cont,kabar gembira bagi para petani di seluruh indonesia pemerintah melalui kementerian koordinator bidang pangan amp kementerian pertanian telah memangkas regulasi yang dinilai memperlambat alur distribusi pupuk bersubsidi dengan adanya kebijakan ini diharapkan petani cont
pembukaan yang ciamik dari mas rambo andika perkasa tegas tanpa marahmarah lugas tanpa melotot pembangunan infrastrukfur dan ketahanan pangan harus ada mitigasi lingkungan utk mengurangi kerusakan lingkungan,pembukaan yang ciamik dari mas rambo andika perkasa tegas tanpa marahmarah lugas tanpa melotot pembangunan infrastrukfur dan ketahanan pangan harus ada mitigasi lingkungan utk mengurangi kerusakan lingkungan
di antaranya menteri kehutanan hanif faisol nurofiq menteri perhubungan dudy purwagandhi menteri pekerjaan umum dody hanggodo menteri pertanian amran sulaiman dan wakil menteri kehutanan sulaiman umar,di antaranya menteri kehutanan hanif faisol nurofiq menteri perhubungan dudy purwagandhi menteri pekerjaan umum dody hanggodo menteri pertanian amran sulaiman dan wakil menteri kehutanan sulaiman umar
selamat amp sukses atas dilantiknya kembali bapak sebagai menteri pertanian ri di kabinet pemerintahan prabowo subianto amp gibran rakabuming raka selamat bekerja membangun keberlanjutan pembangunan di sektor pertanian demi tercukupinya pangan rakyat indonesia,selamat amp sukses atas dilantiknya kembali bapak sebagai menteri pertanian ri di kabinet pemerintahan prabowo subianto amp gibran rakabuming raka selamat bekerja membangun keberlanjutan pembangunan di sektor pertanian demi tercukupinya pangan rakyat indonesia
