Cleaned_Tweet,Segmented_Text
kabinet merah putih dengan semangat kebersamaan siap menjalankan visi pemerintahan kedepan guna mewujudkan bangsa yang maju adil dan makmur menuju indonesia emas bersama kita bentuk pilar kemajuan indonesia,kabinet merah putih dengan semangat kebersamaan siap menjalankan visi pemerintahan kedepan guna mewujudkan bangsa yang maju adil dan makmur menuju indonesia emas bersama kita bentuk pilar kemajuan indonesia
retreat kabinet merah putih aman terkendali berkat pengamanan listrik empat lapis dari pln dukungan penuh untuk kelancaran acara kenegaraan di magelang sc,retreat kabinet merah putih aman terkendali berkat pengamanan listrik empat lapis dari pln dukungan penuh untuk kelancaran acara kenegaraan di magelang sc
sebelumnya presiden prabowo memimpin rapat terbatas bersama sejumlah menteri kabinet merah putih di istana kepresidenan jumat,sebelumnya presiden prabowo memimpin rapat terbatas bersama sejumlah menteri kabinet merah putih di istana kepresidenan jumat
lihat perkembangan infrastruktur sekarang jelas kabinet merah putih punya visi besar buat indonesia,lihat perkembangan infrastruktur sekarang jelas kabinet merah putih punya visi besar buat indonesia
sayangnya anggito tidak menyebutkan jenis mobil maung mana yang akan menteri amp,sayangnya anggito tidak menyebutkan jenis mobil maung mana yang akan menteri amp
kabinet merah putih memastikan kebijakan pengentasan kemiskinan dengan pendekatan yang berbasis data dan teknologi,kabinet merah putih memastikan kebijakan pengentasan kemiskinan dengan pendekatan yang berbasis data dan teknologi
retreat kabinet merah putih di akmil magelang berjalan tanpa kendala pln hadirkan dukungan kelistrikan berlapis demi kelancaran acara yang diinisiasi presiden prabowo sc,retreat kabinet merah putih di akmil magelang berjalan tanpa kendala pln hadirkan dukungan kelistrikan berlapis demi kelancaran acara yang diinisiasi presiden prabowo sc
makin percaya sama kabinet merah putih banyak perubahan positif di bidang ekonomi,makin percaya sama kabinet merah putih banyak perubahan positif di bidang ekonomi
prabowo minta seluruh kabinet merah putih gunakan mobil buatan anak bangsa,prabowo minta seluruh kabinet merah putih gunakan mobil buatan anak bangsa
menanggapi instruksi tersebut anggota kabinet merah putih siap menggunakan mobil dinas maung buatan pt pindad salah satu yang menyampaikan kesiapannya adalah wakil menteri pertanian wamentan sudaryono,menanggapi instruksi tersebut anggota kabinet merah putih siap menggunakan mobil dinas maung buatan pt pindad salah satu yang menyampaikan kesiapannya adalah wakil menteri pertanian wamentan sudaryono
kabinet merah putih fokus pada peningkatan kualitas pendidikan vokasi untuk menciptakan tenaga kerja yang siap bersaing,kabinet merah putih fokus pada peningkatan kualitas pendidikan vokasi untuk menciptakan tenaga kerja yang siap bersaing
maung belum siap kabinet merah putih masih pakai mobil pribadi,maung belum siap kabinet merah putih masih pakai mobil pribadi
profil tujuh penasihat khusus presiden prabowo subianto di kabinet merah putih periode salah satunya seorang dokter militer akademi militer cctv,profil tujuh penasihat khusus presiden prabowo subianto di kabinet merah putih periode salah satunya seorang dokter militer akademi militer cctv
kerja kabinet merah putih belum juga hari sudah menunjukkan hasil yang signifikan luar biasa gebrakannya pak juga berkat efek,kerja kabinet merah putih belum juga hari sudah menunjukkan hasil yang signifikan luar biasa gebrakannya pak juga berkat efek
di bawah presiden prabowo kabinet merah putih memperkuat kebijakan yang mendukung pemberdayaan ekonomi perempuan,di bawah presiden prabowo kabinet merah putih memperkuat kebijakan yang mendukung pemberdayaan ekonomi perempuan
gmni optimistis kabinet merah putih bisa jalankan program prabowogibran,gmni optimistis kabinet merah putih bisa jalankan program prabowogibran
kabinet merah putih terus memperkuat program revitalisasi industri untuk menciptakan lapangan kerja baru,kabinet merah putih terus memperkuat program revitalisasi industri untuk menciptakan lapangan kerja baru
ekonom optimis kabinet merah putih akan membawa indonesia menuju kemandirian ekonomi di tengah tantangan global,ekonom optimis kabinet merah putih akan membawa indonesia menuju kemandirian ekonomi di tengah tantangan global
suasana akmil kembali normal setelah team kabinet merah putih kembali ke jakarta,suasana akmil kembali normal setelah team kabinet merah putih kembali ke jakarta
kabinet merah putih berani mengambil langkah berani untuk masa depan yang lebih baik,kabinet merah putih berani mengambil langkah berani untuk masa depan yang lebih baik
trs kenapa bikin kabinet merahputih,trs kenapa bikin kabinet merahputih
salut kabinet merah putih fokus banget di lingkungan hidup juga,salut kabinet merah putih fokus banget di lingkungan hidup juga
gak usah terlalu banggakan dulu jika kegiatan ospek kabinet merah putih itu pake uang pribadi mungkin beliau talangi dulu benar krn anggaran kementrian masih pake apbn entar th prabowo bisa klaim untuk ganti duitnya ke menhan yg baru kok,gak usah terlalu banggakan dulu jika kegiatan ospek kabinet merah putih itu pake uang pribadi mungkin beliau talangi dulu benar krn anggaran kementrian masih pake apbn entar th prabowo bisa klaim untuk ganti duitnya ke menhan yg baru kok
sekarang tidak ada lagi kim plus yg ada kabinet merah putih sdh ada yg baca buku prabowo strategi transformasi bangsa dari orang yg saya temui di politik orang bicara kebohonganhal kita tunggu ucapan kira sampai berapa tahun kabinet ini akan bertahan,sekarang tidak ada lagi kim plus yg ada kabinet merah putih sdh ada yg baca buku prabowo strategi transformasi bangsa dari orang yg saya temui di politik orang bicara kebohonganhal kita tunggu ucapan kira sampai berapa tahun kabinet ini akan bertahan
selama empat hari jajaran kabinet merah putih melaksanakan retreat di akmil magelang jawa tengah berbagai kegiatan yang dilakukan mulai dari pengarahan bapak presiden ri pembekalan materi tentang pemerintahan upacara parade senja latihan pbb malam keakraban,selama empat hari jajaran kabinet merah putih melaksanakan retreat di akmil magelang jawa tengah berbagai kegiatan yang dilakukan mulai dari pengarahan bapak presiden ri pembekalan materi tentang pemerintahan upacara parade senja latihan pbb malam keakraban
gak perduli saya anda ngutang harus bayar prabowoampgibran itu palsu dan kabinet merah putih palsu utang harus di bayar princes leonor sepia sepin dan kemengku menlu nisa sabyan ani tagih utang piutang mereka borgol semua kabinet abal aball meran putih itu terimakasih kpk,gak perduli saya anda ngutang harus bayar prabowoampgibran itu palsu dan kabinet merah putih palsu utang harus di bayar princes leonor sepia sepin dan kemengku menlu nisa sabyan ani tagih utang piutang mereka borgol semua kabinet abal aball meran putih itu terimakasih kpk
kapolri dan kabinet merah putih bersatu untuk siap amankan nataru semua demi kenyamanan dan ketenangan umat merayakan natal dan tahun baru,kapolri dan kabinet merah putih bersatu untuk siap amankan nataru semua demi kenyamanan dan ketenangan umat merayakan natal dan tahun baru
kabinet merah putih memperkuat kebijakan perlindungan hakhak pekerja,kabinet merah putih memperkuat kebijakan perlindungan hakhak pekerja
kabinet merah putih memastikan stabilitas harga pangan yang mendukung kesejahteraan masyarakat luas,kabinet merah putih memastikan stabilitas harga pangan yang mendukung kesejahteraan masyarakat luas
jakarta retreat kabinet merah putih selama empat hari telah selesai dilaksanakan di akademi militer akmil magelang jawa tengah jateng,jakarta retreat kabinet merah putih selama empat hari telah selesai dilaksanakan di akademi militer akmil magelang jawa tengah jateng
cerita airlangga hingga raffi ahmad usai ikuti retreat kabinet merah putih di magelang,cerita airlangga hingga raffi ahmad usai ikuti retreat kabinet merah putih di magelang
kabinet merah putih berhasil mengimplementasikan kebijakan yang memberdayakan masyarakat pedesaan,kabinet merah putih berhasil mengimplementasikan kebijakan yang memberdayakan masyarakat pedesaan
aldi sibuk banget dah curiga diemdiem dia masuk kabinet merahputih,aldi sibuk banget dah curiga diemdiem dia masuk kabinet merahputih
wapres gibran pulang duluan ketika kegiatan retreat anggota kabinet merah putih bersama presiden prabowo di akmil magelang belum usai,wapres gibran pulang duluan ketika kegiatan retreat anggota kabinet merah putih bersama presiden prabowo di akmil magelang belum usai
pemerintah bakal beli mobil maung pindad untuk kendaraan dinas kabinet merah putih,pemerintah bakal beli mobil maung pindad untuk kendaraan dinas kabinet merah putih
menteri dan pejabat kabinet merah putih wajib lapor lhkpn berikut info lengkap elhkpn,menteri dan pejabat kabinet merah putih wajib lapor lhkpn berikut info lengkap elhkpn
omon ini gak mau keluar uang apbn yg sdh boling jadi makan gratis dr kenaikan pajak yg di bebankan kerakyat biar rakyat miskin buat gaji orang si omon ampkabinet merah putih di naikan gaji secara kita di peras tolak kenaikan pajak,omon ini gak mau keluar uang apbn yg sdh boling jadi makan gratis dr kenaikan pajak yg di bebankan kerakyat biar rakyat miskin buat gaji orang si omon ampkabinet merah putih di naikan gaji secara kita di peras tolak kenaikan pajak
pembangunan ekonomi yang berkeadilan adalah fokus utama dari kabinet merah putih,pembangunan ekonomi yang berkeadilan adalah fokus utama dari kabinet merah putih
kalapas kelas iia samarinda hudi ismono melalui jajaran hadiri monitoring kesiapan satuan kerja pada kementerianlembaga yang mengalami transisi kabinet merah putih,kalapas kelas iia samarinda hudi ismono melalui jajaran hadiri monitoring kesiapan satuan kerja pada kementerianlembaga yang mengalami transisi kabinet merah putih
untuk mempersiapkan liburan natal dan tahun baru kapolri dan kabinet merah putih telah menyiapkan amankan nataru,untuk mempersiapkan liburan natal dan tahun baru kapolri dan kabinet merah putih telah menyiapkan amankan nataru
lingkungan hidup makin terjaga berkat program dari kabinet merah putih,lingkungan hidup makin terjaga berkat program dari kabinet merah putih
maung garuda bakal menjadi kendaraan dinas para menteri kabinet merah putih,maung garuda bakal menjadi kendaraan dinas para menteri kabinet merah putih
performa kabinet merah putih nggak mainmain programprogramnya langsung kerasa dampaknya apresiasi banget,performa kabinet merah putih nggak mainmain programprogramnya langsung kerasa dampaknya apresiasi banget
psikolog sebut najwa shihab kecewa karena tidak masuk kabinet merah putih,psikolog sebut najwa shihab kecewa karena tidak masuk kabinet merah putih
kabinet merah putihnkri semakin kesulitan membiayai program kerja strategis untuk mensukseskan visi presiden prabowo selama thn kedepan sala satu contoh seperti menteri perumahan rakyat dibawa ini,kabinet merah putihnkri semakin kesulitan membiayai program kerja strategis untuk mensukseskan visi presiden prabowo selama thn kedepan sala satu contoh seperti menteri perumahan rakyat dibawa ini
presiden prabowo subianto telah menggelar retret kabinet merah putih di akademi militer magelang jawa tengah dari oktober retret yang berlangsung selama empat hari itu disebutsebut dibiayai sendiri oleh prabowo hal itu disampaikan oleh menteri perlindungan,presiden prabowo subianto telah menggelar retret kabinet merah putih di akademi militer magelang jawa tengah dari oktober retret yang berlangsung selama empat hari itu disebutsebut dibiayai sendiri oleh prabowo hal itu disampaikan oleh menteri perlindungan
kabinet merah putih ayo fokus pada kesehatan rakyat,kabinet merah putih ayo fokus pada kesehatan rakyat
kenapa anda bolak balikkan fakta partai termasuk grindra dan kabinet merah putih itu palsu grup menghayal yang benar kabinet indonesia maju kader kader pdip yang udah di pecat ikut ikutan bikin hox bunda mega kh makruf amin seharusnya kasik paham mereka aduh ribet deh,kenapa anda bolak balikkan fakta partai termasuk grindra dan kabinet merah putih itu palsu grup menghayal yang benar kabinet indonesia maju kader kader pdip yang udah di pecat ikut ikutan bikin hox bunda mega kh makruf amin seharusnya kasik paham mereka aduh ribet deh
apakah kabinet merah putih cukup tenaga menghadapi hadangan komplotan mulyono dengan kelengkapan buzzerinfluencer yang telah naik daun,apakah kabinet merah putih cukup tenaga menghadapi hadangan komplotan mulyono dengan kelengkapan buzzerinfluencer yang telah naik daun
kesepakatan kemitraan umkm dan usaha besar di era kabinet merah putih tembus rp triliun,kesepakatan kemitraan umkm dan usaha besar di era kabinet merah putih tembus rp triliun
kebijakan kabinet merah putih untuk kesehatan mental menjadi prioritas penting,kebijakan kabinet merah putih untuk kesehatan mental menjadi prioritas penting
selama empat hari kabinet merah putih menggelar retreat di akmil magelang jawa tengah dengan semangat kebersamaan kami siap mewujudkan visi pemerintahan demi kemajuan bangsa menuju indonesia emas mari bersama sebagai pilar kemajuan indonesia,selama empat hari kabinet merah putih menggelar retreat di akmil magelang jawa tengah dengan semangat kebersamaan kami siap mewujudkan visi pemerintahan demi kemajuan bangsa menuju indonesia emas mari bersama sebagai pilar kemajuan indonesia
kabinet merah putih mendukung program pertanian organik untuk meningkatkan kualitas pangan dan kesehatan masyarakat,kabinet merah putih mendukung program pertanian organik untuk meningkatkan kualitas pangan dan kesehatan masyarakat
kata nusron wahid dalam keterangannya kamis kegiatan ini akan dipimpin oleh presiden prabowo subianto dan wakil presiden gibran rakabuming raka yang diikuti oleh jajaran kabinet merah putih seluruh anggota kabinet pun berangkat menggunakan pesawat hercules,kata nusron wahid dalam keterangannya kamis kegiatan ini akan dipimpin oleh presiden prabowo subianto dan wakil presiden gibran rakabuming raka yang diikuti oleh jajaran kabinet merah putih seluruh anggota kabinet pun berangkat menggunakan pesawat hercules
koruptor nya kumpul semua di kabinet merah putih yang bapak pimpinrakyat menunggu realisasi dari omongan bapak,koruptor nya kumpul semua di kabinet merah putih yang bapak pimpinrakyat menunggu realisasi dari omongan bapak
kabinet merah putih mendorong investasi di sektor energi terbarukan untuk menciptakan kemandirian energi,kabinet merah putih mendorong investasi di sektor energi terbarukan untuk menciptakan kemandirian energi
kepala komunikasi kepresidenan pco hasan nasbi menjelaskan alasan kegiatan retret jajaran kabinet merah putih di magelang diadakan dengan biaya pribadi presiden prabowo subianto,kepala komunikasi kepresidenan pco hasan nasbi menjelaskan alasan kegiatan retret jajaran kabinet merah putih di magelang diadakan dengan biaya pribadi presiden prabowo subianto
semangat terus kabinet merah putih semoga langkah ini benarbenar berdampak buat kemajuan bangsa,semangat terus kabinet merah putih semoga langkah ini benarbenar berdampak buat kemajuan bangsa
kabinet merah putih berkomitmen memperkuat ketahanan nasional dengan modernisasi angkatan bersenjata,kabinet merah putih berkomitmen memperkuat ketahanan nasional dengan modernisasi angkatan bersenjata
mantap pln turut menyukseskan rangkaian retreat kabinet merah putih yang diinisiasi oleh presiden prabowo subianto di akmil kota magelang,mantap pln turut menyukseskan rangkaian retreat kabinet merah putih yang diinisiasi oleh presiden prabowo subianto di akmil kota magelang
kabinet merah putih mendorong kebijakan ekonomi yang mendukung industri manufaktur nasional,kabinet merah putih mendorong kebijakan ekonomi yang mendukung industri manufaktur nasional
rdp perdana dengan komisi ii dpr ri menteri panrb paparkan program hari untuk akselerasi kinerja kabinet merah putih,rdp perdana dengan komisi ii dpr ri menteri panrb paparkan program hari untuk akselerasi kinerja kabinet merah putih
evolusi kabinet ini jumlah kabinet dulu vs sekarang kabinet merah putih prabowo subianto diklaim sebagai kabinet paling gemuk sejak orde baru hingga reformasi apakah ini langkah strategis atau justru menambah beban birokrasi,evolusi kabinet ini jumlah kabinet dulu vs sekarang kabinet merah putih prabowo subianto diklaim sebagai kabinet paling gemuk sejak orde baru hingga reformasi apakah ini langkah strategis atau justru menambah beban birokrasi
para menteri dan pejabat eselon i di kabinet merah putih diminta tak lagi menggunakan mobil impor sebagai kendaraan dinas,para menteri dan pejabat eselon i di kabinet merah putih diminta tak lagi menggunakan mobil impor sebagai kendaraan dinas
kabinet merah putih mengutamakan kedaulatan bangsa dalam setiap kebijakan yang diambil,kabinet merah putih mengutamakan kedaulatan bangsa dalam setiap kebijakan yang diambil
wapres gibran rakabuming raka selasa ini memanggil sejumlah menteri kabinet merah putih ke kantor wakil presiden,wapres gibran rakabuming raka selasa ini memanggil sejumlah menteri kabinet merah putih ke kantor wakil presiden
sejumlah menteri kabinet merah putih langsung tancap gas usai pembekalan di magelang,sejumlah menteri kabinet merah putih langsung tancap gas usai pembekalan di magelang
hari retreat kabinet merah putih di akmil magelang penuh kegiatan dari pengarahan presiden pembekalan parade senja sampai olahraga bersama pastinya semangat kebersamaan ini memperkuat motivasi amp,hari retreat kabinet merah putih di akmil magelang penuh kegiatan dari pengarahan presiden pembekalan parade senja sampai olahraga bersama pastinya semangat kebersamaan ini memperkuat motivasi amp
dari drama tom lembong ini kita terungat omongan si budi arie yg skrg mentri koperasi kabinet merah putih dan mentri titipan jkw jg kalau kalah kita masuk penjara semua eh yg kalah pilpres anies kebetulan tom lembong timsesnya berarti hukum bisa dipolitisir dong,dari drama tom lembong ini kita terungat omongan si budi arie yg skrg mentri koperasi kabinet merah putih dan mentri titipan jkw jg kalau kalah kita masuk penjara semua eh yg kalah pilpres anies kebetulan tom lembong timsesnya berarti hukum bisa dipolitisir dong
keren banget nih transportasi publik makin bagus thanks kabinet merah putih,keren banget nih transportasi publik makin bagus thanks kabinet merah putih
nasional pertemuan alumni kembali digelar di tengah gegap gempita dengan menyoroti selebrasi kelima kader yang kini duduk di kabinet merah putih,nasional pertemuan alumni kembali digelar di tengah gegap gempita dengan menyoroti selebrasi kelima kader yang kini duduk di kabinet merah putih
kabinet merah putih menciptakan iklim politik yang stabil dan mendukung investasi jangka panjang,kabinet merah putih menciptakan iklim politik yang stabil dan mendukung investasi jangka panjang
ada yg aneh dgn sikap riejik di era presiden prabowo kenapa dia tak koar hujat hina caci maki presiden seperti di era jokowi upsternyata ada jenderal dudung di kabinet merah putih yg dulu pernah ngebungkam congor riejik,ada yg aneh dgn sikap riejik di era presiden prabowo kenapa dia tak koar hujat hina caci maki presiden seperti di era jokowi upsternyata ada jenderal dudung di kabinet merah putih yg dulu pernah ngebungkam congor riejik
komisi pemberantasan korupsi kpk ungkap baru dari pejabat di kabinet merah putih yang telah melaporkan kekayaan penyelenggaraan negara lhkpn simak berita selengkapnya di,komisi pemberantasan korupsi kpk ungkap baru dari pejabat di kabinet merah putih yang telah melaporkan kekayaan penyelenggaraan negara lhkpn simak berita selengkapnya di
kebijakan kabinet merah putih memperhatikan jaminan kesehatan seluruh masyarakat,kebijakan kabinet merah putih memperhatikan jaminan kesehatan seluruh masyarakat
prabowo pasti bisa mengantar kita ke indonesia emas anggota kabinet merah putih diawali dengan pendidikan ilmu militer dlm arti tegas bertindak tak pandang bulu melindungi bangsa dan negara walau sekalipun mengorbankan nyawa,prabowo pasti bisa mengantar kita ke indonesia emas anggota kabinet merah putih diawali dengan pendidikan ilmu militer dlm arti tegas bertindak tak pandang bulu melindungi bangsa dan negara walau sekalipun mengorbankan nyawa
kabinet merah putih bekerja keras demi keadilan sosial bagi seluruh rakyat,kabinet merah putih bekerja keras demi keadilan sosial bagi seluruh rakyat
kabinet merah putih benerbener bikin perubahan nyata ga cuma janjijanji,kabinet merah putih benerbener bikin perubahan nyata ga cuma janjijanji
selama empat hari jajaran kabinet merah putih melaksanakan retreat di akmil magelang jawa tengah semoga kedepanya semakin jaya pilar kemajuan indonesia,selama empat hari jajaran kabinet merah putih melaksanakan retreat di akmil magelang jawa tengah semoga kedepanya semakin jaya pilar kemajuan indonesia
sukses terus buat kabinet merah putih dalam menjalankan tugas pemerintahan kedepannya semoga indonesia lebih maju lagi aamiin,sukses terus buat kabinet merah putih dalam menjalankan tugas pemerintahan kedepannya semoga indonesia lebih maju lagi aamiin
semoga dengan adanya retreat akmil ini bisa saling mempererat tapi silaturahmi antara sesama mentri di kabinet merah putih semangat terus pilar kemajuan indonesia,semoga dengan adanya retreat akmil ini bisa saling mempererat tapi silaturahmi antara sesama mentri di kabinet merah putih semangat terus pilar kemajuan indonesia
pihak istana pun angkat bicara soal kabar tersebut kepala kantor komunikasi kepresidenan hasan nasbi membenarkan presiden prabowo membiayai seluruh kegiatan retreat kabinet merah putih,pihak istana pun angkat bicara soal kabar tersebut kepala kantor komunikasi kepresidenan hasan nasbi membenarkan presiden prabowo membiayai seluruh kegiatan retreat kabinet merah putih
di bawah presiden prabowo kabinet merah putih memperkuat sinergi antara pemerintah pusat dan daerah dalam pembangunan nasional,di bawah presiden prabowo kabinet merah putih memperkuat sinergi antara pemerintah pusat dan daerah dalam pembangunan nasional
kabinet merah putih memastikan akses layanan kesehatan berkualitas hingga ke daerah pelosok,kabinet merah putih memastikan akses layanan kesehatan berkualitas hingga ke daerah pelosok
simbol pemerintahan selain itu beliau dalam amanatnya juga menyampaikan delapan asta cita kabinet merah putih yaitu memperkokoh ideology pancasila dan memperkuat pembangunan sdm menuju indonesia emas pertahanan,simbol pemerintahan selain itu beliau dalam amanatnya juga menyampaikan delapan asta cita kabinet merah putih yaitu memperkokoh ideology pancasila dan memperkuat pembangunan sdm menuju indonesia emas pertahanan
kata bapak menteri kabinet merah putih yg bapak pimpin sosok cendikiawan jujur tangguh pemikir dan pekerja keras loh kok kaget sekarang bahasa itu sangat penting pak utk seorang menteri timnas saja pada belajar bhs inggris kok masih ada menteri yg ngga bisa b inggris,kata bapak menteri kabinet merah putih yg bapak pimpin sosok cendikiawan jujur tangguh pemikir dan pekerja keras loh kok kaget sekarang bahasa itu sangat penting pak utk seorang menteri timnas saja pada belajar bhs inggris kok masih ada menteri yg ngga bisa b inggris
bapak presiden dalam programnya mempunyai visi misi yang disebut dengan asta cita kabinet merah putih,bapak presiden dalam programnya mempunyai visi misi yang disebut dengan asta cita kabinet merah putih
kabinet merah putih mengutamakan pengembangan wilayah maritim untuk memperkuat kedaulatan laut indonesia,kabinet merah putih mengutamakan pengembangan wilayah maritim untuk memperkuat kedaulatan laut indonesia
langkah kabinet merah putih mengikuti retret di akmil magelang membuktikan komitmen untuk mewujudkan indonesia yang lebih solid dan kuat semoga energi kebersamaan ini membawa kita ke visi indonesia emas,langkah kabinet merah putih mengikuti retret di akmil magelang membuktikan komitmen untuk mewujudkan indonesia yang lebih solid dan kuat semoga energi kebersamaan ini membawa kita ke visi indonesia emas
kabinet merah putih yang dibentuk oleh presiden ri prabowo subianto dan wakil presiden gibran rakabuming raka mencakup sejumlah tokoh perempuan dalam posisi menteri dan wakil menteri setelah dilantik pada oktober prabowo mengumumkan susunan,kabinet merah putih yang dibentuk oleh presiden ri prabowo subianto dan wakil presiden gibran rakabuming raka mencakup sejumlah tokoh perempuan dalam posisi menteri dan wakil menteri setelah dilantik pada oktober prabowo mengumumkan susunan
selamat bekerja untuk tim kabinet merah putih prabowo gibran tetap semangat dan jadikan sebagai pilar kemajuan indonesia,selamat bekerja untuk tim kabinet merah putih prabowo gibran tetap semangat dan jadikan sebagai pilar kemajuan indonesia
bukan hanya menteri kabinet merah putih aja yang digembleng tapi oneiro juga,bukan hanya menteri kabinet merah putih aja yang digembleng tapi oneiro juga
chanyeol kan masuk kabinet merah putih,chanyeol kan masuk kabinet merah putih
di bawah presiden prabowo kabinet merah putih memperkuat hubungan internasional untuk memperluas akses pasar global,di bawah presiden prabowo kabinet merah putih memperkuat hubungan internasional untuk memperluas akses pasar global
semangat dan semoga sehat selalu untuk jajaran kabinet merah putih,semangat dan semoga sehat selalu untuk jajaran kabinet merah putih
ada kader muhammadiyah di kabinet merah putih berikut profilnya,ada kader muhammadiyah di kabinet merah putih berikut profilnya
kabinet merah putih berhasil menciptakan iklim investasi yang positif,kabinet merah putih berhasil menciptakan iklim investasi yang positif
kabinet merah putih makin kuat,kabinet merah putih makin kuat
jenderal sigit merespons cepat arahan presiden prabowo subianto di hari pertama setelah mengikuti retreat kabinet merah putih di magelang jawa tengah selengkapnya,jenderal sigit merespons cepat arahan presiden prabowo subianto di hari pertama setelah mengikuti retreat kabinet merah putih di magelang jawa tengah selengkapnya
