Cleaned_Tweet,Segmented_Text
segera reshuffle orang problematik yg ada di kabinet pemerintahan bapak jangan sampai org jokowi ini mengganggu stabilitas politik pak hentikan sekarang sebelum terlambat tito bahlil budi arie pratikno listyo sigit agus subianto budi sadikin,segera reshuffle orang problematik yg ada di kabinet pemerintahan bapak jangan sampai org jokowi ini mengganggu stabilitas politik pak hentikan sekarang sebelum terlambat tito bahlil budi arie pratikno listyo sigit agus subianto budi sadikin
menteri sekretaris negara sekaligus juru bicara presiden ri prasetyo hadi menegaskan bahwa presiden prabowo subianto rutin mengevaluasi menterimenterinya di kabinet merah putih,menteri sekretaris negara sekaligus juru bicara presiden ri prasetyo hadi menegaskan bahwa presiden prabowo subianto rutin mengevaluasi menterimenterinya di kabinet merah putih
presiden dan mas wapres seiring sejalan dalam menjalankan kan roda pemerintahan saling melengkapi satu sama lain harmonisasi nampak jelas tergambar baru kali ini terlihat seperti ini roda pemerintahan istilah wong jawa tumbu nemu tutup semoga membawa,presiden dan mas wapres seiring sejalan dalam menjalankan kan roda pemerintahan saling melengkapi satu sama lain harmonisasi nampak jelas tergambar baru kali ini terlihat seperti ini roda pemerintahan istilah wong jawa tumbu nemu tutup semoga membawa
presiden prabowo subianto dijadwalkan menggelar rapat terbatas ratas dengan para menteri kabinet merah putih di hambalang bogor jawa barat pada pukul wib senin ta,presiden prabowo subianto dijadwalkan menggelar rapat terbatas ratas dengan para menteri kabinet merah putih di hambalang bogor jawa barat pada pukul wib senin ta
pada selasa malam kemarin agustus presiden prabowo subianto secara mendadak memanggil sejumlah menteri kabinet merah putih dan beberapa kepala lembaga di kediaman pribadinya di hambalang bogor tulis sekretaris kabinet seskab,pada selasa malam kemarin agustus presiden prabowo subianto secara mendadak memanggil sejumlah menteri kabinet merah putih dan beberapa kepala lembaga di kediaman pribadinya di hambalang bogor tulis sekretaris kabinet seskab
pernyataan ketua mpr ri ahmad muzani yang menyentil para menteri kabinet merah putih dianggap signifikan sentilan itu terkait kinerja menteri yang kerap menjadi beban presiden prabowo subianto lantaran kebijakan yang diambil tidak melalui kajian komprehensif,pernyataan ketua mpr ri ahmad muzani yang menyentil para menteri kabinet merah putih dianggap signifikan sentilan itu terkait kinerja menteri yang kerap menjadi beban presiden prabowo subianto lantaran kebijakan yang diambil tidak melalui kajian komprehensif
presiden prabowo subianto memanggil sejumlah menteri kabinet merah putih dan beberapa kepala lembaga ke kediaman pribadinya di hambalang kabupaten bogor jawa barat,presiden prabowo subianto memanggil sejumlah menteri kabinet merah putih dan beberapa kepala lembaga ke kediaman pribadinya di hambalang kabupaten bogor jawa barat
mensesneg prasetyo hadi membantah pernyataan ketua umum partai golkar bahlil lahadalia yang menyinggung rencana presiden prabowo subianto melakukan reshuffle perombakan susunan menteri dalam kabinet merah putih,mensesneg prasetyo hadi membantah pernyataan ketua umum partai golkar bahlil lahadalia yang menyinggung rencana presiden prabowo subianto melakukan reshuffle perombakan susunan menteri dalam kabinet merah putih
ketua mpr ri ahmad muzani menyatakan bahwa reshuffle atau perombakan susunan menteri dalam kabinet merah putih merupakan hak istimewa atau hak prerogatif yang dimiliki presiden prabowo subianto,ketua mpr ri ahmad muzani menyatakan bahwa reshuffle atau perombakan susunan menteri dalam kabinet merah putih merupakan hak istimewa atau hak prerogatif yang dimiliki presiden prabowo subianto
presiden ri prabowo subianto wakil presiden ri gibran rakabuming raka beserta sejumlah jajaran menteri dan pejabat kabinet merah putih menyerahkan zakat melalui badan amil zakat nasional baznas di istana negara jakarta kamis,presiden ri prabowo subianto wakil presiden ri gibran rakabuming raka beserta sejumlah jajaran menteri dan pejabat kabinet merah putih menyerahkan zakat melalui badan amil zakat nasional baznas di istana negara jakarta kamis
tadi malam selasa agustus presiden prabowo mendadak memanggil sejumlah menteri kabinet merah putih di kediaman pribadinya di hambalang bogor ujar teddy,tadi malam selasa agustus presiden prabowo mendadak memanggil sejumlah menteri kabinet merah putih di kediaman pribadinya di hambalang bogor ujar teddy
kepemimpinan presiden prabowo bersama wapres gibran jadi teladan penegakan ham martabat dan pembangunan nasional di bawah naungan konstitusi,kepemimpinan presiden prabowo bersama wapres gibran jadi teladan penegakan ham martabat dan pembangunan nasional di bawah naungan konstitusi
menteri kesehatan budi gunadi sadikin menanggapi isu penggantian dirinya atau reshuffle dari susunan menteri dalam kabinet merah putih yang akan dilakukan presiden prabowo subianto dengan menyatakan keputusan tersebut adalah hak presiden,menteri kesehatan budi gunadi sadikin menanggapi isu penggantian dirinya atau reshuffle dari susunan menteri dalam kabinet merah putih yang akan dilakukan presiden prabowo subianto dengan menyatakan keputusan tersebut adalah hak presiden
presiden prabowo subianto mengadakan rapat bersama sejumlah menteri kabinet merah putih di rumah pribadinya hambalang kabupaten bogor jawa barat pada rabu agustus,presiden prabowo subianto mengadakan rapat bersama sejumlah menteri kabinet merah putih di rumah pribadinya hambalang kabupaten bogor jawa barat pada rabu agustus
presiden prabowo subianto masih menyatakan puas dengan kinerja kabinet merah putih dan tidak berencana reshuffle dalam waktu dekat berdasarkan pernyataan resmi awal agustus dari jakarta post dan antara news pantau update resmi untuk perubahan korupsi tetap jadi isu,presiden prabowo subianto masih menyatakan puas dengan kinerja kabinet merah putih dan tidak berencana reshuffle dalam waktu dekat berdasarkan pernyataan resmi awal agustus dari jakarta post dan antara news pantau update resmi untuk perubahan korupsi tetap jadi isu
pada selasa malam kemarin agustus presiden prabowo subianto secara mendadak memanggil sejumlah menteri kabinet merah putih dan beberapa kepala lembaga di kediaman pribadinya di hambalang bogor tulis seskab teddy,pada selasa malam kemarin agustus presiden prabowo subianto secara mendadak memanggil sejumlah menteri kabinet merah putih dan beberapa kepala lembaga di kediaman pribadinya di hambalang bogor tulis seskab teddy
prabowo inspektur upacara bikin kabinet jumbo menteri kabinet merah putih biar timnya lengkap dan siap kerja cepat,prabowo inspektur upacara bikin kabinet jumbo menteri kabinet merah putih biar timnya lengkap dan siap kerja cepat
jelas begini pembagian tugas wamen presiden prabowo istana amp presiden,jelas begini pembagian tugas wamen presiden prabowo istana amp presiden
ini namanama menteri presiden ke ri prabowo subianto prabowo mengumumkan susunan kabinetnya bernama kabinet merah putih minggu malam,ini namanama menteri presiden ke ri prabowo subianto prabowo mengumumkan susunan kabinetnya bernama kabinet merah putih minggu malam
prabowo subianto benarbenar menjalankan misi keberlanjutan pemerintahan jokowi selain mempertahankan menteri jokowi ia merekrut orang bermasalah secara hukum dan etika ke dalam kabinetnya prabowo juga membentuk lembaga baru yang menabrak undangundang,prabowo subianto benarbenar menjalankan misi keberlanjutan pemerintahan jokowi selain mempertahankan menteri jokowi ia merekrut orang bermasalah secara hukum dan etika ke dalam kabinetnya prabowo juga membentuk lembaga baru yang menabrak undangundang
kejutan prabowo kemungkinan besar bakal mempertahankan sri mulyani sebagai menkeu sementara meutya hafid yang sebelumnya menjabat sebagai ketua komisi i dpr akan ditunjuk menjadi menkominfo menggantikan budi arie yang digeser ke posisi lain bagaimana dengan pos kementerian,kejutan prabowo kemungkinan besar bakal mempertahankan sri mulyani sebagai menkeu sementara meutya hafid yang sebelumnya menjabat sebagai ketua komisi i dpr akan ditunjuk menjadi menkominfo menggantikan budi arie yang digeser ke posisi lain bagaimana dengan pos kementerian
presiden prabowo subianto akan menggembleng para menteri kabinet merah putih setelah pelantikan pada beberapa hari lalu  presiden akan membawa para anggota kabinetnya ke akademi militer di lembah gunung tidar magelang selama hari mulai tanggal oktober,presiden prabowo subianto akan menggembleng para menteri kabinet merah putih setelah pelantikan pada beberapa hari lalu presiden akan membawa para anggota kabinetnya ke akademi militer di lembah gunung tidar magelang selama hari mulai tanggal oktober
baru hari kedua di kantor ini dia rencana kerja menterimenterinya prabowo selengkapnya baca di sini deh,baru hari kedua di kantor ini dia rencana kerja menterimenterinya prabowo selengkapnya baca di sini deh
prabowo tunjuk muhammad syafii jadi wakil menteri agama doanya pernah bikin geger di sidang tahunan mpr menyentil jokowi,prabowo tunjuk muhammad syafii jadi wakil menteri agama doanya pernah bikin geger di sidang tahunan mpr menyentil jokowi
lsm presiden prabowo bersama rakyat,lsm presiden prabowo bersama rakyat
menteri udah wakil menteri udah sekarang mari kita tengok profil kepala badan setingkat menteri yang baru aja dilantik prabowo selasa yok kita cek satusatu narasi daily,menteri udah wakil menteri udah sekarang mari kita tengok profil kepala badan setingkat menteri yang baru aja dilantik prabowo selasa yok kita cek satusatu narasi daily
presiden prabowo subianto secara terbuka menegur sekretaris kabinet teddy indra wijaya dalam acara pembukaan sidang tanwir dan resepsi milad ke muhammadiyah di kupang ntt rabu hal ini terjadi setelah prabowo merasa catatan sambutannya tidak lengkap saat,presiden prabowo subianto secara terbuka menegur sekretaris kabinet teddy indra wijaya dalam acara pembukaan sidang tanwir dan resepsi milad ke muhammadiyah di kupang ntt rabu hal ini terjadi setelah prabowo merasa catatan sambutannya tidak lengkap saat
dengan penuh rasa syukur dan gembira saya meresmikan terowongan silaturahmi yang menghubungkan masjid istiqlal dan gereja katedral terowongan ini bukan hanya menjadi simbol kerukunan antarumat beragama tetapi juga mencerminkan semangat persatuan dan kebhinekaan yang menjadi,dengan penuh rasa syukur dan gembira saya meresmikan terowongan silaturahmi yang menghubungkan masjid istiqlal dan gereja katedral terowongan ini bukan hanya menjadi simbol kerukunan antarumat beragama tetapi juga mencerminkan semangat persatuan dan kebhinekaan yang menjadi
setelah resmi mengemban amanah sebagai presiden republik indonesia saya melaksanakan lepas sambut di kementerian pertahanan selama tahun terakhir saya berkesempatan mengabdi dan bekerja di kementerian ini demi pertahanan bangsa saya percaya saudara sjafrie sjamsoeddin,setelah resmi mengemban amanah sebagai presiden republik indonesia saya melaksanakan lepas sambut di kementerian pertahanan selama tahun terakhir saya berkesempatan mengabdi dan bekerja di kementerian ini demi pertahanan bangsa saya percaya saudara sjafrie sjamsoeddin
jajaran menteri di kabinet merah putih pimpinan presiden prabowo subianto langsung mendapat teguran dari istana di saat belum genap sepekan mereka dilantik sebagai menteri teguran dilayangkan oleh sekretaris kabinet mayor teddy indra wijaya kepada jajaran menteri kabinet,jajaran menteri di kabinet merah putih pimpinan presiden prabowo subianto langsung mendapat teguran dari istana di saat belum genap sepekan mereka dilantik sebagai menteri teguran dilayangkan oleh sekretaris kabinet mayor teddy indra wijaya kepada jajaran menteri kabinet
mudarat kabinet besar prabowo jumlah kementerian dalam kabinet pemerintahan prabowo subianto berkisar atau lebih dpr akan menetapkan jumlah komisi atau alat kelengkapan dewan akd yang disesuaikan dengan jumlah kementerian kabinet prabowo pada senin ini atau selasa besok,mudarat kabinet besar prabowo jumlah kementerian dalam kabinet pemerintahan prabowo subianto berkisar atau lebih dpr akan menetapkan jumlah komisi atau alat kelengkapan dewan akd yang disesuaikan dengan jumlah kementerian kabinet prabowo pada senin ini atau selasa besok
thread kerja pemerintahan prabowofufufafa akan di update terus setiap hari hari ke yusril tragedi bukan pelanggaran ham berat mayor teddy tidak perlu mundur dari tni meski menjabat sebagai seskab dwi fungsi tni hidup lagi natalius pigai menkumham,thread kerja pemerintahan prabowofufufafa akan di update terus setiap hari hari ke yusril tragedi bukan pelanggaran ham berat mayor teddy tidak perlu mundur dari tni meski menjabat sebagai seskab dwi fungsi tni hidup lagi natalius pigai menkumham
untuk dunia olahraga ini jelas jadi keputusan yang menarik taufik hidayat yang selama ini vokal memperjuangkan kondisi atlet kini bakal punya wewenang untuk membantu membuat kebijakan yang berpengaruh pada kehidupan atlet,untuk dunia olahraga ini jelas jadi keputusan yang menarik taufik hidayat yang selama ini vokal memperjuangkan kondisi atlet kini bakal punya wewenang untuk membantu membuat kebijakan yang berpengaruh pada kehidupan atlet
memimpin sidang kabinet paripurna bersama jajaran menteri kepala badan dan wakil menteri di istana negara jakarta saya turut menyampaikan apresiasi atas keberhasilan awal pemerintahan kami seperti kebijakan penghapusan utang kenaikan upah minimum serta penyelenggaraan,memimpin sidang kabinet paripurna bersama jajaran menteri kepala badan dan wakil menteri di istana negara jakarta saya turut menyampaikan apresiasi atas keberhasilan awal pemerintahan kami seperti kebijakan penghapusan utang kenaikan upah minimum serta penyelenggaraan
kebaikan itu menular setelah presiden prabowo membiayai kegiatan retreat para menteri wamen kepala lembaga serta stafsus dengan dana pribadi disusul menteri perumahan rakyat maruarar sirait yang menghibahkan tanahnya bakal dibangun perumahan rakyat sekarang raffi ngikut,kebaikan itu menular setelah presiden prabowo membiayai kegiatan retreat para menteri wamen kepala lembaga serta stafsus dengan dana pribadi disusul menteri perumahan rakyat maruarar sirait yang menghibahkan tanahnya bakal dibangun perumahan rakyat sekarang raffi ngikut
rill kah bocoran daftar lengkap menteri amp wakil di kabinet prabowo,rill kah bocoran daftar lengkap menteri amp wakil di kabinet prabowo
politik balas budi kabinet prabowo sebagian besar calon menteri dan wakil menteri di kabinet prabowo subianto berasal dari partai politik terafiliasi dengan partai serta dari tim pendukungnya dalam pemilihan presiden wajah kabinet prabowo mendatang sarat dengan politik,politik balas budi kabinet prabowo sebagian besar calon menteri dan wakil menteri di kabinet prabowo subianto berasal dari partai politik terafiliasi dengan partai serta dari tim pendukungnya dalam pemilihan presiden wajah kabinet prabowo mendatang sarat dengan politik
sebetulnya menteri pendidikan dasar amp menengah dari kabinet merah putih yang berasal dari ormas agama mengetahui agama mana yang sejak lama menghambat proses pendidikan untuk mencerdaskan bangsa bila kita yang memberi tahu akan dituduh melakukan penistaan agama,sebetulnya menteri pendidikan dasar amp menengah dari kabinet merah putih yang berasal dari ormas agama mengetahui agama mana yang sejak lama menghambat proses pendidikan untuk mencerdaskan bangsa bila kita yang memberi tahu akan dituduh melakukan penistaan agama
joke presiden prabowo di tanwir muhammadiyah kalau saya undang partai untuk koalisi saya minta calon terbaik mereka gak tanyatanya itu muhammadiyah atau bukan tapi sesudah dilantik ada yang bisikbisik itu muhammadiyah pak kata prabowo saat berbicara di tanwir bertempat,joke presiden prabowo di tanwir muhammadiyah kalau saya undang partai untuk koalisi saya minta calon terbaik mereka gak tanyatanya itu muhammadiyah atau bukan tapi sesudah dilantik ada yang bisikbisik itu muhammadiyah pak kata prabowo saat berbicara di tanwir bertempat
jika daftar ini valid sungguh awal yg sangat mengecewakan dari rezim prabowo hanya ada perempuan sangat disgusting patriarkinya menkeunya kurang kredibel bisa nasib ri sama kayak argentina menteri perikanannya amsyong,jika daftar ini valid sungguh awal yg sangat mengecewakan dari rezim prabowo hanya ada perempuan sangat disgusting patriarkinya menkeunya kurang kredibel bisa nasib ri sama kayak argentina menteri perikanannya amsyong
awalnya pak jokowi mau naik pesawat komersial pulang ke solo tp presiden prabowo tdk izinkan amp perintahkan panglima tni amp kapolri mengantar pak jokowi menggunakan pesawat tniau yg nebeng bukan pak jokowi tp ente yg nebeng hidup amp cari makan di indonesiamungkin juga sakit,awalnya pak jokowi mau naik pesawat komersial pulang ke solo tp presiden prabowo tdk izinkan amp perintahkan panglima tni amp kapolri mengantar pak jokowi menggunakan pesawat tniau yg nebeng bukan pak jokowi tp ente yg nebeng hidup amp cari makan di indonesiamungkin juga sakit
presiden tunjuk adik kandunganya hashim djojohadikusumo jadi utusan khusus ri di cop kemarin anda bisa bayangkan seorang pebisnis tambang menjadi utusan khusus untuk terlibat dalam pertemuan penting yang membahas perubahan iklim dan seperti yang kita ketahui,presiden tunjuk adik kandunganya hashim djojohadikusumo jadi utusan khusus ri di cop kemarin anda bisa bayangkan seorang pebisnis tambang menjadi utusan khusus untuk terlibat dalam pertemuan penting yang membahas perubahan iklim dan seperti yang kita ketahui
pergantian ini menunjukkan betapa besar pengaruh prabowo dalam menempatkan orangorang kepercayaannya di posisi strategis meskipun alasan di balik perubahan tersebut tidak selalu transparan bagi publik,pergantian ini menunjukkan betapa besar pengaruh prabowo dalam menempatkan orangorang kepercayaannya di posisi strategis meskipun alasan di balik perubahan tersebut tidak selalu transparan bagi publik
inilah yang dilakukan presiden kepada mantan presiden jokowi inilah yang tidak dilakukan presiden jokowi kepada mantan presiden sby di tahun dulu inilah yang dinamakan adab tidak usah berspekulasi macammacam cuma satu macam saja spekulasi saya ada,inilah yang dilakukan presiden kepada mantan presiden jokowi inilah yang tidak dilakukan presiden jokowi kepada mantan presiden sby di tahun dulu inilah yang dinamakan adab tidak usah berspekulasi macammacam cuma satu macam saja spekulasi saya ada
hari ini saya diundang ke istana negara untuk hadir dalam acara makan siang bersama bapak presiden beserta jajaran menteri kabinet indonesia maju menjelang purnatugas terima kasih kepada bapak presiden jokowi yang telah mempercayakan saya untuk mengemban tanggung jawab,hari ini saya diundang ke istana negara untuk hadir dalam acara makan siang bersama bapak presiden beserta jajaran menteri kabinet indonesia maju menjelang purnatugas terima kasih kepada bapak presiden jokowi yang telah mempercayakan saya untuk mengemban tanggung jawab
awal militeristis pemerintahan prabowo kegiatan retret kabinet prabowo subianto di akademi militer magelang dinilai tak penting dan memboroskan anggaran negara kegiatan itu bertentangan dengan pernyataan awal prabowo agar anggota kabinetnya menggunakan anggaran secara,awal militeristis pemerintahan prabowo kegiatan retret kabinet prabowo subianto di akademi militer magelang dinilai tak penting dan memboroskan anggaran negara kegiatan itu bertentangan dengan pernyataan awal prabowo agar anggota kabinetnya menggunakan anggaran secara
presiden prabowo subianto meminta seluruh menteri untuk mengkaji lagi alokasi apbn pada pos kementerian masingmasing prabowo meminta agar para menteri mengurangi kegiatankegiatan yang bersifat seremonial dan perjalanan luar negeri yang terlalu banyak,presiden prabowo subianto meminta seluruh menteri untuk mengkaji lagi alokasi apbn pada pos kementerian masingmasing prabowo meminta agar para menteri mengurangi kegiatankegiatan yang bersifat seremonial dan perjalanan luar negeri yang terlalu banyak
profil menko prabowo pernah jadi tersangka kpk hingga pemilik perusahaan pembersih sedimen laut,profil menko prabowo pernah jadi tersangka kpk hingga pemilik perusahaan pembersih sedimen laut
prabowo ke menteri tak ada yang kebal copot pejabat yang tak kerja keras,prabowo ke menteri tak ada yang kebal copot pejabat yang tak kerja keras
sebanyak organisasi kemasyarakatan ormas lintas agama di indonesia mendorong agar yaqut cholil qoumas gus yaqut kembali diberi amanah untuk masuk dalam kabinet prabowogibran mereka menilai selama menjabat menteri agama menag gus yaqut mampu mewujudkan kehidupan,sebanyak organisasi kemasyarakatan ormas lintas agama di indonesia mendorong agar yaqut cholil qoumas gus yaqut kembali diberi amanah untuk masuk dalam kabinet prabowogibran mereka menilai selama menjabat menteri agama menag gus yaqut mampu mewujudkan kehidupan
presiden prabowo subianto menggelar sidang kabinet paripurna di ruang sidang kabinet kantor presiden jakarta yang dihadiri wakil presiden gibran rakabuming dan jajaran menteri kabinet merah putih dalam sidang tersebut presiden prabowo menyampaikan pengarahan,presiden prabowo subianto menggelar sidang kabinet paripurna di ruang sidang kabinet kantor presiden jakarta yang dihadiri wakil presiden gibran rakabuming dan jajaran menteri kabinet merah putih dalam sidang tersebut presiden prabowo menyampaikan pengarahan
jadi gini istri yandri susanto ini kan calon bupati kab serang yandri susanto kader pan yang baru dilantik oleh prabowo menjadi menteri desa memakai kop surat kementerian desa utk mengorganisir massa dari semua desa se kramat watu untuk haul ibunda tercinta surat,jadi gini istri yandri susanto ini kan calon bupati kab serang yandri susanto kader pan yang baru dilantik oleh prabowo menjadi menteri desa memakai kop surat kementerian desa utk mengorganisir massa dari semua desa se kramat watu untuk haul ibunda tercinta surat
prabowo minta menteri tak ragu telepon saat ia lawatan ke luar negeri tinggalkan hal yang protokoler dan feodal,prabowo minta menteri tak ragu telepon saat ia lawatan ke luar negeri tinggalkan hal yang protokoler dan feodal
prabowo ke menteri anggotamu jangan banyak jalan ke luar negeri,prabowo ke menteri anggotamu jangan banyak jalan ke luar negeri
kabinetnya pak prabowo merangkul semua gelar mulai dari gelar yg ecek ecek sampai gelar yg betulan ada juga yg anti zionis sampai yg dukung zionis juga ada wkwkwk,kabinetnya pak prabowo merangkul semua gelar mulai dari gelar yg ecek ecek sampai gelar yg betulan ada juga yg anti zionis sampai yg dukung zionis juga ada wkwkwk
sobatani presiden ri melaksanakan kunjungan kerja perdananya untuk meninjau langsung lokasi optimasi lahan di kabupaten merauke dengan didampingi oleh menteri pertanian pada minggu kunjungan kerja presiden prabowo menunjukkan komitmen,sobatani presiden ri melaksanakan kunjungan kerja perdananya untuk meninjau langsung lokasi optimasi lahan di kabupaten merauke dengan didampingi oleh menteri pertanian pada minggu kunjungan kerja presiden prabowo menunjukkan komitmen
prabowo baru hari berkuasa dah menteri blunder menkokumham yusril bilang tragedi bukan pelanggaran ham berat menteri desapdt yandri susanto pake surat kementerian u acara pribadi menham pigai minta anggaran t berlomba dalam blunder,prabowo baru hari berkuasa dah menteri blunder menkokumham yusril bilang tragedi bukan pelanggaran ham berat menteri desapdt yandri susanto pake surat kementerian u acara pribadi menham pigai minta anggaran t berlomba dalam blunder
banyak juga ya menteri prabowo titipan haji isam,banyak juga ya menteri prabowo titipan haji isam
menteri agama paling ideal untuk negeri super majemuk seperti indonesia adalah figur yg menjunjung tinggi keanekaragaman agama dan kepercayaan pak nasaruddin umar salah satu pilihan prabowo yg terbaik utk menteri agama negeri ini,menteri agama paling ideal untuk negeri super majemuk seperti indonesia adalah figur yg menjunjung tinggi keanekaragaman agama dan kepercayaan pak nasaruddin umar salah satu pilihan prabowo yg terbaik utk menteri agama negeri ini
pak presiden salah pilih orang utusan khusus presiden bidang kerukunan beragama dan pembinaan sarana keagamaan kok kelakuan nya begini gak ada akhlak padahal penceramah bikin malu bpk saja tuh,pak presiden salah pilih orang utusan khusus presiden bidang kerukunan beragama dan pembinaan sarana keagamaan kok kelakuan nya begini gak ada akhlak padahal penceramah bikin malu bpk saja tuh
catat ini nama pejabat kemenperin yang melawan himbauan prabowo sekretaris jenderal kemenperin eko cahyanto kepala pusat pemberdayaan industri halal nila kumalasari direktur akses sumber daya industri dan promosi internasional syahroni ahmad direktur,catat ini nama pejabat kemenperin yang melawan himbauan prabowo sekretaris jenderal kemenperin eko cahyanto kepala pusat pemberdayaan industri halal nila kumalasari direktur akses sumber daya industri dan promosi internasional syahroni ahmad direktur
selamat mengemban amanah sebagai menteri agama prof dr nasaruddin umar mudahan amanah sukses dan barokah bagi rakyat indonesia semoga allah selalu membimbingnya kementerian agama itu mengemban amanah sila pertama utk sila berikutnya alfatihah,selamat mengemban amanah sebagai menteri agama prof dr nasaruddin umar mudahan amanah sukses dan barokah bagi rakyat indonesia semoga allah selalu membimbingnya kementerian agama itu mengemban amanah sila pertama utk sila berikutnya alfatihah
